id,title,original_language,overview,poster_path,genre_ids,popularity,release_date,vote_average,vote_count
269149,Zootopia,en,"Determined to prove herself, Officer Judy Hopps, the first bunny on Zootopia's police force, jumps at the chance to crack her first case - even if it means partnering with scam-artist fox Nick Wilde to solve the mystery.",/hlK0e0wAQ3VLuJcsfIYPvb4JVud.jpg,"[16, 12, 10751, 35]",86.873,2016-02-11,7.748,15565
82690,Wreck-It Ralph,en,"Wreck-It Ralph is the 9-foot-tall, 643-pound villain of an arcade video game named Fix-It Felix Jr., in which the game's titular hero fixes buildings that Ralph destroys. Wanting to prove he can be a good guy and not just a villain, Ralph escapes his game and lands in Hero's Duty, a first-person shooter where he helps the game's hero battle against alien invaders. He later enters Sugar Rush, a kart racing game set on tracks made of candies, cookies and other sweets. There, Ralph meets Vanellope von Schweetz who has learned that her game is faced with a dire threat that could affect the entire arcade, and one that Ralph may have inadvertently started.",/zWoIgZ7mgmPkaZjG0102BSKFIqQ.jpg,"[10751, 16, 35, 12]",56.777,2012-11-01,7.333,11767
499,Cléo from 5 to 7,fr,"Agnès Varda eloquently captures Paris in the sixties with this real-time portrait of a singer set adrift in the city as she awaits test results of a biopsy. A chronicle of the minutes of one woman’s life, Cléo from 5 to 7 is a spirited mix of vivid vérité and melodrama, featuring a score by Michel Legrand and cameos by Jean-Luc Godard and Anna Karina.",/oelBStY4xpguaplRv15P3Za7Xsr.jpg,"[18, 10402]",19.608,1962-04-11,7.7,620
451995,Faces Places,fr,Director Agnès Varda and photographer/muralist JR journey through rural France and form an unlikely friendship.,/1NX6NTj9FiiJwEgRUmEifSzE7Na.jpg,[99],10.86,2017-06-28,7.674,362
44018,Vagabond,fr,"Mona Bergeron is dead, her frozen body found in a ditch in the French countryside. From this, the film flashes back to the weeks leading up to her death. Through these flashbacks, Mona gradually declines as she travels from place to place, taking odd jobs and staying with whomever will offer her a place to sleep. Mona is fiercely independent, craving freedom over comfort, but it is this desire to be free that will eventually lead to her demise.",/2KFfwiPct1hwqi9dkKqoom0BenC.jpg,[18],8.665,1985-12-04,7.285,270
565310,The Farewell,en,A headstrong Chinese-American woman returns to China when her beloved grandmother is given a terminal diagnosis. Billi struggles with her family's decision to keep grandma in the dark about her own illness as they all stage an impromptu wedding to see grandma one last time.,/7UrIarxfjxZC9YGj8H1ATKZMXVy.jpg,"[35, 18]",16.725,2019-07-12,7.434,1315
296178,Posthumous,en,"After false reports of his demise put him and his work on the map, an artist decides to continue the charade by posing as his own brother. Soon, a reporter enters his life and has a profound effect on him.",/1hdmv4WobFEvsV7C3wdeLcOJSrU.jpg,"[35, 18, 10749]",5.138,2014-10-04,5.86,50
405774,Bird Box,en,"Five years after an ominous unseen presence drives most of society to suicide, a survivor and her two children make a desperate bid to reach safety.",/rGfGfgL2pEPCfhIvqHXieXFn7gp.jpg,"[27, 53, 18]",26.642,2018-12-13,6.849,9401
164251,Serena,en,"North Carolina mountains at the end of the 1920s – George and Serena Pemberton, love-struck newly-weds, begin to build a timber empire. Serena soon proves herself to be equal to any man: overseeing loggers, hunting rattle-snakes, even saving a man’s life in the wilderness. With power and influence now in their hands, the Pembertons refuse to let anyone stand in the way of their inflated love and ambitions. However, once Serena discovers George’s hidden past and faces an unchangeable fate of her own, the Pemberton’s passionate marriage begins to unravel leading toward a dramatic reckoning.",/A1EnhqXiPQMo5QP7eBWLFpeOvKB.jpg,[18],18.791,2014-10-12,5.627,978
10439,Hocus Pocus,en,"After 300 years of slumber, three sister witches are accidentally resurrected in Salem on Halloween night, and it is up to three kids and their newfound feline friend to put an end to the witches' reign of terror once and for all.",/by4D4Q9NlUjFSEUA1yrxq6ksXmk.jpg,"[14, 35, 10751]",35.483,1993-07-16,7.049,2823
62838,New Year's Eve,en,The lives of several couples and singles in New York intertwine over the course of New Year's Eve.,/nNh8PDzkx4dUdNYtlzAiprpNs5e.jpg,"[35, 10749]",24.625,2011-12-08,5.869,2048
156708,Afternoon Delight,en,"Rachel is a quick-witted and lovable stay-at-home mom. Frustrated with the realities of preschool auctions, a lacklustre sex life and career that's gone kaput, she visits a strip club to spice up her marriage and meets McKenna, a stripper she adopts as her live-in nanny.",/qlgPBk5xZzHHPfrimBFV46QuktX.jpg,"[35, 18]",16.777,2013-08-30,5.739,203
620629,Transparent: Musicale Finale,en,"When the Pfeffermans face a life-changing loss, they begin a journey hilarious and melancholy, brazen and bold. As they face this new transition, they confront grief and come together to celebrate connection, joy, and transformation.",/rJDA6yfLAc49NbTQQ9DeU5rlRXC.jpg,"[18, 35, 10402, 10770]",4.122,2019-09-27,6.2,16
242224,The Babadook,en,"A single mother, plagued by the violent death of her husband, battles with her son's fear of a monster lurking in the house, but soon discovers a sinister presence all around her.",/qt3fqapeo94TfvMyld8P7gkpXLz.jpg,"[18, 27]",23.09,2014-05-22,6.526,5708
400090,The Nightingale,en,"In 1825, Clare, a 21-year-old Irish convict, chases a British soldier through the rugged Tasmanian wilderness, bent on revenge for a terrible act of violence he committed against her family. She enlists the services of an Aboriginal tracker who is also marked by trauma from his own violence-filled past.",/hWA8QwSM1kJYMoTANEPoqrqBapg.jpg,"[18, 53]",15.462,2018-09-23,7.087,509
693,Meet the Fockers,en,"Hard-to-crack ex-CIA man Jack Byrnes and his wife Dina head for the warmer climes of Florida to meet the parents of their son-in-law-to-be, Greg Focker. Unlike their happily matched offspring, the future in-laws find themselves in a situation of opposites that definitely do not attract.",/59fXm6N2x7QSbvt6BaBxTNBXGL8.jpg,"[35, 10749]",28.927,2004-12-22,6.242,4533
39451,Little Fockers,en,"It has taken 10 years, two little Fockers with wife Pam and countless hurdles for Greg to finally get in with his tightly wound father-in-law, Jack. After the cash-strapped dad takes a job moonlighting for a drug company, Jack's suspicions about his favorite male nurse come roaring back. When Greg and Pam's entire clan descends for the twins' birthday party, Greg must prove to the skeptical Jack that he's fully capable as the man of the house.",/90mwPRNMmX9RUGVgKMJMJNQnYX8.jpg,"[35, 10749]",20.966,2010-12-21,5.65,3091
10236,The Way We Were,en,"Two desperate people have a wonderful romance, but their political views and convictions drive them apart.",/o5x563ze56iI4iNsCBxTnDkt28i.jpg,"[18, 10749]",9.233,1973-10-17,6.925,421
524434,Eternals,en,"The Eternals are a team of ancient aliens who have been living on Earth in secret for thousands of years. When an unexpected tragedy forces them out of the shadows, they are forced to reunite against mankind’s most ancient enemy, the Deviants.",/lFByFSLV5WDJEv3KabbdAF959F2.jpg,"[878, 28, 12]",75.498,2021-11-03,6.9,7765
581734,Nomadland,en,"A woman in her sixties embarks on a journey through the western United States after losing everything in the Great Recession, living as a van-dwelling modern-day nomad.",/8Vc5EOUEIF1EUXuX9eLFf7BvN3P.jpg,[18],22.418,2021-01-29,7.222,2767
453278,The Rider,en,"Once a rising star of the rodeo circuit, and a gifted horse trainer, young cowboy Brady is warned that his riding days are over after a horse crushed his skull at a rodeo. In an attempt to regain control of his own fate, Brady undertakes a search for a new identity and what it means to be a man in the heartland of the United States.",/cFsrA0Is5xode2INrPj1VJcQ18n.jpg,"[18, 37]",11.494,2018-03-28,7.271,461
147554,The Cabbage-Patch Fairy,fr,A brief fantasy tale involving a strange fairy who can produce and deliver babies coming out of cabbages.  This film is lost or never existed. Copies of it online are actually the 1900 remake.,/2QZGHPgFcOPvPKJew0MQHF45dkj.jpg,"[14, 10751]",3.66,1896-03-31,5.203,86
147624,Falling Leaves,en,"It's early autumn and Dr. Headley eagerly demonstrates what seems to be a miraculous cure for tuberculosis. Not far from where he is working, the disease seems preparing to soon claim yet another life, a teenage girl named Winifred. Winifred's mother and little sister Trixie are devastated. When Trixie hears the family doctor say of Winifred that ""when the last leaf falls, she will have passed away,"" she interprets the doctor's words literally. Thinking over what she has heard, she determines to do everything possible to save her sister.",/jTerx1tfB8u5InphZfzCa9uyJ3D.jpg,[18],3.569,1912-03-15,6.586,76
120026,The Consequences of Feminism,fr,It's a society in which gender roles are switched. Will men stand to be unequal?,/7ZzPyv5g4ohGcPbbmkF2ZYMe02N.jpg,[35],2.666,1906-01-01,6.32,50
216015,Fifty Shades of Grey,en,"When college senior Anastasia Steele steps in for her sick roommate to interview prominent businessman Christian Grey for their campus paper, little does she realize the path her life will take. Christian, as enigmatic as he is rich and powerful, finds himself strangely drawn to Ana, and she to him. Though sexually inexperienced, Ana plunges headlong into an affair -- and learns that Christian's true sexual proclivities push the boundaries of pain and pleasure.",/63kGofUkt1Mx0SIL4XI4Z5AoSgt.jpg,"[18, 10749, 53]",115.72,2015-02-11,5.9,11296
490132,Green Book,en,"Tony Lip, a bouncer in 1962, is hired to drive pianist Don Shirley on a tour through the Deep South in the days when African Americans, forced to find alternate accommodations and services due to segregation laws below the Mason-Dixon Line, relied on a guide called The Negro Motorist Green Book.",/7BsvSuDQuoqhWmU2fL7W2GOcZHU.jpg,"[18, 36]",52.074,2018-11-16,8.243,10851
771,Home Alone,en,"Eight-year-old Kevin McCallister makes the most of the situation after his family unwittingly leaves him behind when they go on Christmas vacation. But when a pair of bungling burglars set their sights on Kevin's house, the plucky kid stands ready to defend his territory. By planting booby traps galore, adorably mischievous Kevin stands his ground as his frantic mother attempts to race home before Christmas Day.",/onTSipZ8R3bliBdKfPtsDuHTdlL.jpg,"[35, 10751]",3.351,1990-11-16,7.4,10613
49444,Kung Fu Panda 2,en,"Po is now living his dream as The Dragon Warrior, protecting the Valley of Peace alongside his friends and fellow kung fu masters, The Furious Five - Tigress, Crane, Mantis, Viper and Monkey. But Po’s new life of awesomeness is threatened by the emergence of a formidable villain, who plans to use a secret, unstoppable weapon to conquer China and destroy kung fu. It is up to Po and The Furious Five to journey across China to face this threat and vanquish it. But how can Po stop a weapon that can stop kung fu? He must look to his past and uncover the secrets of his mysterious origins; only then will he be able to unlock the strength he needs to succeed.",/mtqqD00vB4PGRt20gWtGqFhrkd0.jpg,"[16, 10751, 35]",67.673,2011-05-25,6.987,6584
140300,Kung Fu Panda 3,en,"While Po and his father are visiting a secret panda village, an evil spirit threatens all of China, forcing Po to form a ragtag army to fight back.",/oajNi4Su39WAByHI6EONu8G8HYn.jpg,"[28, 12, 16, 35, 10751]",57.699,2016-01-23,6.885,5515
207703,Kingsman: The Secret Service,en,The story of a super-secret spy organization that recruits an unrefined but promising street kid into the agency's ultra-competitive training program just as a global threat emerges from a twisted tech genius.,/17i5YPTfHOjXoieArpATWGRhLj1.jpg,"[80, 35, 28, 12]",88.14,2014-12-13,7.635,15966
127585,X-Men: Days of Future Past,en,The ultimate X-Men ensemble fights a war for the survival of the species across two time periods as they join forces with their younger selves in an epic battle that must change the past – to save our future.,/tYfijzolzgoMOtegh1Y7j2Enorg.jpg,"[28, 12, 878]",67.714,2014-05-15,7.524,14670
49538,X-Men: First Class,en,"Before Charles Xavier and Erik Lensherr took the names Professor X and Magneto, they were two young men discovering their powers for the first time. Before they were arch-enemies, they were closest of friends, working together with other mutants (some familiar, some new), to stop the greatest threat the world has ever known.",/b9r6lsLuzBONdSokQ3O2JiVmy0C.jpg,"[28, 878, 12]",4.759,2011-06-01,7.297,12190
433092,Tokyo Idols,ja,"This exploration of Japan's fascination with girl bands and their music follows an aspiring pop singer and her fans, delving into the cultural obsession with young female sexuality and the growing disconnect between men and women in hypermodern societies.",/2U9zEqSO7ulORWjNRr3RbgoJgLb.jpg,"[10402, 99]",7.473,2017-07-28,6.696,46
333473,Brakeless,ja,"Documentary exploring one of Japan's biggest train crashes in modern history, caused when a driver tried to catch up with a delay of just 80 seconds. It's a cautionary tale of what happens when punctuality, protocol and efficiency are taken to the extreme. On Monday April 25th 2005, a West Japan Railway commuter train crashed into an apartment building and killed 107 people. Just what pressures made the driver risk so much for such a minimal delay?  Piecing together personal accounts of those affected by the train crash, with insights from experts and former train drivers, the film poses a question for a society that equates speed with progress. It offers a fascinating insight into the railway's role in Japan's post-war economic boom and the dangers of corner-cutting in the prolonged economic stagnation that followed. Through the lens of this catastrophic train crash, Brakeless considers the ultimate cost efficiency.",,[99],0.6,2014-03-19,7.8,2
401775,My Atomic Aunt,ja,"Film director Kyoko Miyake remembered Namie, a fishing village ravaged by the 2011 Fukushima nuclear catastrophe, as her childhood paradise. Revisiting her family’s hometown after 10 years abroad, Miayke’s multilayered documentary examines the disaster’s profound personal, social and environmental impact.",/m7QixqJLhzEGwEC8wTm7aTzXp4g.jpg,[99],0.629,2013-03-08,0.0,0
369364,A Girl in the River: The Price of Forgiveness,pa,A woman in Pakistan sentenced to death for falling in love becomes a rare survivor of the country's harsh judicial system.,/iXwiT1dBrRxPpswddALB2kmqAmq.jpg,[99],4.574,2015-10-28,7.4,40
651166,Sitara: Let Girls Dream,en,"Pari, a 14-year-old girl, dreams of becoming a pilot while growing up in a society that doesn’t allow her to dream.",/oUkL1fx66yp7k0Oxx3LyySIGBep.jpg,"[16, 18]",3.952,2019-09-23,6.958,36
121873,Hannah Arendt,de,"HANNAH ARENDT is a portrait of the genius that shook the world with her discovery of “the banality of evil.” After she attends the Nazi Adolf Eichmann’s trial in Jerusalem, Arendt dares to write about the Holocaust in terms no one has ever heard before. Her work instantly provokes a furious scandal, and Arendt stands strong as she is attacked by friends and foes alike. But as the German-Jewish émigré also struggles to suppress her own painful associations with the past, the film exposes her beguiling blend of arrogance and vulnerability — revealing a soul defined and derailed by exile.",/kB4hUbhIYmx7Xdpo1DGn15pstO3.jpg,[18],9.083,2012-09-11,6.938,257
4762,The Lost Honor of Katharina Blum,de,"After a chance encounter with a wanted man, a woman is harassed by the police and press until she takes violent action.",/d7Z1gzPkHm29jmiqnjvzXZg2koI.jpg,[18],7.213,1975-01-10,7.006,89
2011,Persepolis,fr,"In 1970s Iran, Marjane 'Marji' Statrapi watches events through her young eyes and her idealistic family of a long dream being fulfilled of the hated Shah's defeat in the Iranian Revolution of 1979. However as Marji grows up, she witnesses first hand how the new Iran, now ruled by Islamic fundamentalists, has become a repressive tyranny on its own.",/aU8i2QAdTyRR1nYb36Gq51xXP8p.jpg,"[16, 18]",12.565,2007-06-27,7.906,1822
244458,The Voices,en,"A mentally unhinged factory worker must decide whether to listen to his talking cat and become a killer, or follow his dog's advice to keep striving for normalcy.",/weY5OVSFmxvA3D4lfyhgvugklEh.jpg,"[35, 80, 27, 14]",16.244,2014-01-19,6.248,1660
480857,Radioactive,en,The story of Nobel Prize winner Marie Curie and her extraordinary scientific discoveries—through the prism of her marriage to husband Pierre—and the seismic and transformative effects their discovery of radium had on the 20th century.,/akHIQu8W3rOgT28r25ggXaKcQIr.jpg,"[18, 10749, 36]",14.601,2020-03-11,6.6,761
4539,Hearts of Darkness: A Filmmaker's Apocalypse,en,"A chronicle of the production problems — including bad weather, actors' health, war near the filming locations, and more — which plagued the filming of Apocalypse Now, increasing costs and nearly destroying the life and career of Francis Ford Coppola.",/nVMCtL3r2nj4fySihDDvamaVkfx.jpg,[99],11.065,1991-11-27,7.9,332
375867,Paris Can Wait,en,"Anne is at a crossroads in her life. Long married to a successful, driven but inattentive movie producer, she unexpectedly finds herself taking a car trip from Cannes to Paris with Jacques, a business associate of her husband. What should be a seven-hour drive turns into a carefree two-day adventure replete with diversions involving picturesque sights, fine food and wine, humor, wisdom and romance - reawakening Anne's senses and giving her a new lust for life.",/jLzfHNU1JldQpC5TNEvQMnWQxx6.jpg,"[35, 18, 10749]",12.118,2016-09-12,5.796,223
164121,Coda: Thirty Years Later,en,"A behind-the-scenes look at the trials and tribulations of filmmaker Francis Ford Coppola directing his first film in ten years, Youth Without Youth (2007).",,"[99, 10770]",3.842,2007-12-09,4.8,5
605760,"Part One: Where There Is a Joyous Mood, There a Comrade Will Appear to Share a Glass of Wine",en,"'Part One: Where There Is a Joyous Mood, There a Comrade Will Appear to Share a Glass of Wine' concerns affective relations and community building. The film is like a spell or a promise for a new and more liberating type of family structure. The film has a non-linear narrative that weaves various intimate settings, some within shared domestic spaces, others in outdoor environments. Shot in Lithuania, London, and Edinburgh, the film features the artist and her children, as well as close friends, which she considers extended family.",,[],0.6,,0.0,0
456356,Carlo's Vision,en,A man drives through Rome. Film about Pasolini.,,[],0.6,2011-02-02,0.0,0
373829,This Quality,en,,,[],0.6,2010-01-02,0.0,0
544404,Who You Think I Am,fr,"Claire, a romantically spurned 50-year-old divorced teacher, creates a fake Facebook profile of a 24-year-old woman to spy on her on-and-off lover.",/woZuI9pSg9mmaaILkVubbrbJmmP.jpg,"[18, 10749]",15.765,2019-02-27,6.587,305
348025,Families,fr,"Jérôme Varenne, a French financier, lives and works in Shanghai with Chen-Li, his life and business partner. One day, during a short stay in Paris, while paying a call to his mother, he is very displeased to learn from her and his hated brother, that the family house in Ambray is going to be sold. Jerome decides to go to the town where he grew up to see what is going on. Little does he know how eventful his escapade will be. Little does he know that it will change his life from soup to nuts...",/2iJ2UcUx28IA3BzWutMb5WHmsLe.jpg,"[35, 18]",4.409,2015-10-14,4.665,88
39543,My American Uncle,fr,"Prof. Henri Laborit uses the stories of the lives of three people to discuss behaviorist theories of survival, combat, rewards and punishment, and anxiety. René is a technical manager at a textile factory and must face the anxiety caused by corporate downsizing. Janine is a self-educated actress/stylist who learns that the wife of her lover is dying and must decide to let them reunite. Jean is a controversial career-climbing writer/politician at a crossroads in life.",/e9gbeslzPIav8ELEPRrKB1EzonF.jpg,"[35, 18, 10749]",8.316,1980-05-21,6.9,171
924,Dawn of the Dead,en,"A group of survivors take refuge in a shopping mall after the world is taken over by aggressive, flesh-eating zombies.",/ttquyxStEEctzghtA2f4PUGprDr.jpg,"[28, 27, 80, 18, 14]",48.931,2004-03-19,7.046,3726
31011,Mr. Nobody,en,"Nemo Nobody leads an ordinary existence with his wife and 3 children; one day, he wakes up as a mortal centenarian in the year 2092.",/qNkIONc4Rgmzo23ph7qWp9QfVnW.jpg,"[878, 18, 10749]",29.27,2009-11-06,7.826,5619
37707,Splice,en,"Elsa and Clive, two young rebellious scientists, defy legal and ethical boundaries and forge ahead with a dangerous experiment: splicing together human and animal DNA to create a new organism. Named ""Dren"", the creature rapidly develops from a deformed female infant into a beautiful but dangerous winged human-chimera, who forges a bond with both of her creators - only to have that bond turn deadly.",/4oqaWnO3dKYAt3vZWAD4oLfOXOC.jpg,"[27, 878]",24.6,2009-10-06,5.867,2123
18480,Brüno,en,Flamboyantly gay Austrian television reporter Bruno stirs up trouble with unsuspecting guests and large crowds through brutally frank interviews and painfully hilarious public displays of homosexuality.,/xLFYL5gwCPnMDp5Qmd5wiRSsRPX.jpg,[35],22.607,2009-07-08,5.615,1609
44115,127 Hours,en,The true story of mountain climber Aron Ralston's remarkable adventure to save himself after a fallen boulder crashes on his arm and traps him in an isolated canyon in Utah.,/xbszsQv3ifdFZtQu8CzNh4zh0MX.jpg,"[12, 18, 53]",34.099,2010-11-12,7.077,7150
9779,The Sisterhood of the Traveling Pants,en,"Four best friends (Tibby, Lena, Carmen &amp; Bridget) who buy a mysterious pair of pants that fits each of them, despite their differing sizes, and makes whoever wears them feel fabulous. When faced with the prospect of spending their first summer apart, the pals decide they'll swap the pants so that each girl in turn can enjoy the magic.",/wNshlUT6IZEz2AF3iZrlb2mX0pR.jpg,"[18, 35, 10749]",17.185,2005-06-01,6.475,1236
68718,Django Unchained,en,"With the help of a German bounty hunter, a freed slave sets out to rescue his wife from a brutal Mississippi plantation owner.",/7oWY8VDWW7thTzWh3OKYRkWUlD5.jpg,"[18, 37]",64.55,2012-12-25,8.175,25199
208000,William & Catherine: A Royal Romance,en,"The film is based on the story of William of Cambridge and Catherine Middleton. Shown in the same life of William of Cambridge, and Catherine Middleton met at the University of Saint Andrews, besides the romance that they maintained, the break of it and commitment.",/diV7KoQ3xRsZmLuZyp3E7oFIuCc.jpg,"[10749, 18, 10770]",4.633,2012-04-30,5.4,43
412532,The Last Film Festival,en,"Dennis Hopper plays Nick Twain, a Hollywood Producer whose latest film is rejected by every film festival in the world except one- in Ohio. Nick will do anything to get his film distributed, including manipulating his dysfunctional cast into attending the festival. Hollywood egos and small town politics inevitably collide.",/jUC5u21rwSUKeHJEBXQPfUhGwO6.jpg,[35],1.702,2016-09-16,3.8,8
257179,Northern Lights,en,"A stranger's call informs Roberta that her estranged brother Frank has died in a small town under bizarre circumstances. Ben, his best friend from college, also gets the call. Arriving just in time for his funeral, it becomes quickly obvious to them that the little slice of small-town America in which they find themselves is like an episode of The Twilight Zone featuring Frank's eccentric friends, his amazing secrets and his stunning final request. Both Ben and Roberta are shocked to discover that Frank not only had a child, but that he has left them responsible for his son's care.",/ihbttaRj7eN90e745Km4Gf6Vef8.jpg,"[18, 10770]",2.848,1998-07-02,5.625,8
617502,Jolt,en,A bouncer with an anger management problem goes on a furious and resentful rampage after the murder of a friend.,/gYZAHan5CHPFXORpQMvOjCTug4E.jpg,"[28, 53]",29.143,2021-07-15,6.6,1143
75802,Hysteria,en,"Two doctors in Victorian England use manual stimulation of female genitalia to cure their patients' ills, leading to the invention of the vibrator.",/ziWnXi2VyNDD9qPi5wmOuolOCIu.jpg,"[35, 10749]",12.645,2011-06-06,6.661,774
547012,Buffaloed,en,"Set in the underworld of debt-collecting, homegrown hustler Peg Dahl will do anything to escape Buffalo, NY.",/h37VMJAm4EhKC3k6I6K20VHaSQe.jpg,"[35, 18]",23.721,2020-02-14,6.735,221
450489,Irreplaceable You,en,"A stunning cancer diagnosis spurs Abbie to seek a future girlfriend for fiancé and childhood sweetheart Sam, who's clueless when it comes to dating.",/hkflwtWCJffdDSwg63fdDFbwOvS.jpg,"[35, 18, 10749]",13.353,2018-02-16,6.961,675
339984,Miracles from Heaven,en,"When Christy discovers her 10-year-old daughter Anna has a rare, incurable disease, she becomes a ferocious advocate for her daughter’s healing as she searches for a solution. After Anna has a freak accident and falls three stories, a miracle unfolds in the wake of her dramatic rescue that leaves medical specialists mystified, her family restored and their community inspired.",/hz9VF1TfaM0D04pYneSXUkNeOZv.jpg,"[10751, 18]",47.075,2016-03-17,7.4,1129
19994,Jennifer's Body,en,"Jennifer, a gorgeous, seductive cheerleader takes evil to a whole new level after she's possessed by a sinister demon. Now it's up to her best friend to stop Jennifer's reign of terror before it's too late.",/wrkjsGcFJxcQqR56kJUYAEKKg2T.jpg,"[27, 35]",33.184,2009-09-18,5.915,3543
