id,title,original_language,overview,poster_path,genre_ids,popularity,release_date,vote_average,vote_count
979342,Grindr Baby,en,A non-monogamous queer couple grapples with a pregnancy test after one of them has an unprotected one night stand. Knocked Up but if Seth Rogen was pregnant.,/x9KRyZ9N5onMoJp0bczel2yBtgy.jpg,[35],0.633,2022-06-18,0.0,0
632250,Miller & Son,en,"A transwoman mechanic lives between running her family’s auto shop during the day and expressing her femininity at night, until an unforeseen event threatens the delicate balance.",/whryw08CfWOhoVXRApYFiqHtgq2.jpg,[18],1.352,2019-04-14,6.4,7
987923,Young Adult,en,"On the last day of a summer camp for persons with disabilities, a teenage girl fights to connect the boy that might be the love of her life.",/A8g8rTSpdDKvKC1Y5zgf2NnwaD2.jpg,[18],0.846,2017-01-01,0.0,0
13403,Hedwig and the Angry Inch,en,"Raised a boy in East Berlin, Hedwig undergoes a personal transformation in order to emigrate to the U.S., where she reinvents herself as an “internationally ignored” but divinely talented rock diva, inhabiting a “beautiful gender of one.”",/jafIFAW8sHQkzWPGoMDR4892dFI.jpg,"[35, 10402, 18]",12.394,2001-07-20,7.4,347
33762,Band of the Hand,en,An Indian Vietnam veteran trains five street punks in the Everglades to fight vice in Miami.,/tkeECMVzEBC9TijuTlN8dZ1SX8G.jpg,[28],9.497,1986-04-11,6.5,49
341689,How to Talk to Girls at Parties,en,"In 1970s London, a teenage outsider named Enn falls in love with a rebellious alien girl named Zan, who has come to Earth for a party. Together, they navigate the complexities of intergalactic culture and the trials of first love.",/v6mPfyGshwXd1R6kQlMEyZ8Zu2s.jpg,"[35, 10402, 10749, 878]",12.24,2017-10-06,6.039,355
286217,The Martian,en,"During a manned mission to Mars, Astronaut Mark Watney is presumed dead after a fierce storm and left behind by his crew. But Watney has survived and finds himself stranded and alone on the hostile planet. With only meager supplies, he must draw upon his ingenuity, wit and spirit to subsist and find a way to signal to Earth that he is alive.",/5BHuvQ6p9kfc091Z8RiFNhCwL4b.jpg,"[18, 12, 878]",52.79,2015-09-30,7.683,18886
59860,Monte Carlo,en,Three young women vacationing in Paris find themselves whisked away to Monte Carlo after one of the girls is mistaken for a British heiress.,/dcbqyycrWA56HXq5lm41HYuED8Y.jpg,"[12, 35, 10749]",28.983,2011-07-01,6.564,2026
14245,Sniper 2,en,"A former Marine sniper is lured back in on a top-secret mission to take out a rogue general accused of running a stealth operation of hit-and-run ethnic cleansing missions in an area known as ""No Man's Land.""",/dmHfc2h9bpCFOloUj54jntM0c9L.jpg,[28],16.172,2002-12-28,5.39,132
133805,Carrie,en,"A reimagining of the classic horror tale about Carrie White, a shy girl outcast by her peers and sheltered by her deeply religious mother, who unleashes telekinetic terror on her small town after being pushed too far at her senior prom.",/kloXz9qwO23z9Kbt3z3MgnjF4xO.jpg,"[18, 27]",22.806,2013-10-16,6.029,4273
226,Boys Don't Cry,en,A young transgender man explores his gender identity and searches for love in rural Nebraska.,/nKXTgbruSrezC1tAeKB6Ri7cGkK.jpg,"[80, 18]",17.397,1999-09-02,7.437,1232
776501,We're All Going to the World's Fair,en,"Reality and fantasy begin to blur when a teenager, alone in her attic bedroom, immerses herself in a role-playing horror game online.",/fXn4Nz1WCTEmzAFvwgEZoPHvptR.jpg,"[18, 27]",9.699,2022-04-15,5.38,79
530074,A Self-Induced Hallucination,en,"It's about the internet, and it's quite strange.",/2xAnDV5X6cDPCfQMNTQFGGf1dHC.jpg,[99],1.165,2019-01-25,5.0,1
534389,The School Is Watching,en,"Good morning, Bear River High School. This documentary is made up entirely of high school morning announcement broadcasts from the 1990s.",/eDerq0lp7Ryfgi0gkz505HJhmHc.jpg,"[99, 35]",1.131,2015-06-21,0.0,0
156708,Afternoon Delight,en,"Rachel is a quick-witted and lovable stay-at-home mom. Frustrated with the realities of preschool auctions, a lacklustre sex life and career that's gone kaput, she visits a strip club to spice up her marriage and meets McKenna, a stripper she adopts as her live-in nanny.",/qlgPBk5xZzHHPfrimBFV46QuktX.jpg,"[35, 18]",16.777,2013-08-30,5.739,203
620629,Transparent: Musicale Finale,en,"When the Pfeffermans face a life-changing loss, they begin a journey hilarious and melancholy, brazen and bold. As they face this new transition, they confront grief and come together to celebrate connection, joy, and transformation.",/rJDA6yfLAc49NbTQQ9DeU5rlRXC.jpg,"[18, 35, 10402, 10770]",4.122,2019-09-27,6.2,16
537061,Steven Universe: The Movie,en,"Two years after bringing peace to the galaxy, Steven Universe sees his past come back to haunt him in the form of a deranged Gem who wants to destroy the Earth.",/8mRgpubxHqnqvENK4Bei30xMDvy.jpg,"[10770, 16, 12, 35, 14, 10402]",22.191,2019-09-02,8.215,795
486233,Adam,en,"Adam, an awkward teen, spends a summer with his older sister, who is part of New York City's lesbian and trans activist scene. He meets the girl of his dreams but can't figure out how to tell her he's not the trans man she thinks he is.",/n4HBr4ps1OwO6OuNWG4Vt22kUfF.jpg,[35],3.804,2019-08-14,4.1,25
458878,The Thing,en,"There's something missing in Tristan and Zooey's relationship. Zooey has spent weeks planning a road trip to a mysterious roadside attraction known as 'The Thing' in the hopes that she and Tristan will reconnect. Both Tristan, an FTM transman, and his fluffy cat Steven struggle to find places to comfortably pee, while Zooey learns the open road isn't everything she hoped it would be. Will they find what they're looking for at 'The Thing'?",/fpHlHYHrf9EfYxRIDGCKzezwyzo.jpg,"[35, 18]",0.788,2012-10-24,5.3,3
653610,Disclosure,en,"An investigation of how Hollywood's fabled stories have deeply influenced how Americans feel about transgender people, and how transgender people have been taught to feel about themselves.",/2MB2FPNxdSlykbH7ghBltoBYnTH.jpg,[99],20.009,2020-06-19,7.98,125
322695,Boy I Am,en,"While female-to-male transgender visibility has recently exploded in this country, conversations about trans issues in the lesbian community often run into resistance from the many queer women who view transitioning as a ""trend"" or as an anti-feminist act that taps into male privilege. Boy I Am is a feature-length documentary that begins to break down that barrier and promote dialogue about trans issues through a look at the experiences of three young transitioning FTMs in New York City--Nicco, Norie and Keegan--as they go through major junctures in their transitions, as well as through the voices of lesbians, activists and theorists who raise and address the questions that many people have but few openly discuss.",,[99],0.6,2006-09-09,3.7,3
260476,Kate Bornstein Is a Queer & Pleasant Danger,en,"For decades, performance artist and writer Kate Bornstein has been exploding binaries and deconstructing gender. And, her own identity. Trans-dyke. Reluctant polyamorist. Sadomasochist. Recovering Scientologist. Pioneering Gender Outlaw. Kate Bornstein Is a Queer and Pleasant Danger, joins her on her latest tour capturing rollicking public performances and painful personal revelations as it bears witness to Kate as a trailblazing artist theorist activist who inhabits a space between male and female with wit, style, and astonishing candor. By turns meditative and playful, the film invites us on a thought provoking journey through Kate's world to seek answers to some of life's biggest questions.",/rkB25R5i8Jqa94HLEQ8iSXdOhE3.jpg,[99],1.154,2014-06-17,6.0,2
634025,The Whistle,en,"A 45 year old Latinx trans man returns to his birthplace - Albuquerque, New Mexico - in search for the origin of a secret lesbian code he learned when he identified as a teenage dyke in the 80s.",/x2UBHxUqFEUPHqqakfMyfqNsUfT.jpg,[],0.6,2019-06-21,1.0,1
428612,Strong Island,en,"Examining the violent death of the filmmaker’s brother and the judicial system that allowed his killer to go free, this documentary interrogates murderous fear and racialized perception, and re-imagines the wreckage in catastrophe’s wake, challenging us to change.",/waXERQjJdXz7iIGMlSrP8OGzSE8.jpg,[99],7.846,2017-01-23,6.335,86
417367,Boys On Film 15: Time & Tied,en,"Embark on a magical journey through time with Boys On Film 15: Time & Tied — featuring a brand new selection of sensational gay British short films that showcase some of the UK's best emerging talent. This compilation features nine complete films:  Lloyd Eyre-Morgan's ""Closets"" starring Tommy Knight and Ceallach Spellman; Brian Fairbairn & Karl Eccleston's ""Putting On The Dish"" starring Steve Wickenden and Neil Chinneck; Mitchell Marion's ""G O'Clock"" starring Marc Rovira Cenar and Phillip Weddell; Charlie Parham's ""Nightstand"" starring Nicholas Gleaves and Amrou Al-Kadhi; Simon Anderson's ""Morning Is Broken"" starring Matthew Tennyson, Nigel Allen and Jack Hawkins; Tom Frederic's ""Sauna The Dead: A Fairy Tale"" starring himself and Kumar Muniandy; Leon Lopez's ""CrossRoad"" starring Marc Rovira Cenar, Ashley Campbell, and Calum Ewan Cameron; Jake Graf's ""Dawn"" starring Nicole Gibson and Harry Rundle; and Kristen Bjorn's ""Trouser Bar"" starring Denholm Spurr, Scott Hunter, and Zac Renfree.",/vByY0vjcBY3fRVBAj9reeurrYcw.jpg,"[14, 35, 80, 18, 10749, 27]",1.641,2016-08-22,7.4,9
465646,Boys On Film 16: Possession,en,"Golden boys, teen lust, self-conscious dolls, chance encounters, a vengeful creature, holiday romance, hidden sexuality — Boys On Film celebrates it's (not so) sweet sixteen with an astonishing selection of the latest international gay short films.  Volume 16: Possession features ten complete films: Kai Stänicke's ""Golden"" with Christian Tesch and Maximilian Gehrlinger; Christopher Manning's ""Jamie"" starring Sebastian Christophers and Raphael Verrion; Kai Stänicke's ""B."" starring Susanne Bormann and Andreas Jähnert; Blake Mawson's ""PYOTR495"" starring Alex Ozerov; Charlie Francis's ""When A Man Loves A Woman"" starring Tommy Jay Brennan, Jemima Spence, and Diane Brooks Webster; Anthony Schatteman's ""Follow Me"" starring Ezra Fieremans and Maarten Ketels; Jake Graf's ""Chance"" starring 'ABS' and Clifford Hume; Andrew Keenan-Bolger's ""Sign"" starring John McGinty and Preston Sadleir; Oliver Mason's ""Away With Me"" starring Chris Polick and Lee Knight; and ""We Could Be Parents"" by Björn Elgerd.",/YKZUZimFkoZe0wFYRXZiF4XWDD.jpg,"[14, 10749, 18, 27, 35, 16]",1.624,2017-05-21,5.0,5
579614,Dusk,en,"Growing up in 1950s England in an intolerant and uninformed world, young Chris Winters struggles to fit into the gender roles dictated by wider society.",/iM5Mek9gUYrMXHWxMkB0pQ5brFe.jpg,"[18, 10749]",0.979,2017-04-28,6.8,4
881419,Edible,en,Secrets come to light when Celeste and her girlfriend Sara try an edible marijuana cookie.,/3skz3Vsva1ZLY5xwbtZwJbAT4ZI.jpg,[18],0.6,2020-09-18,0.0,0
881419,Edible,en,Secrets come to light when Celeste and her girlfriend Sara try an edible marijuana cookie.,/3skz3Vsva1ZLY5xwbtZwJbAT4ZI.jpg,[18],0.6,2020-09-18,0.0,0
552835,The Garden Left Behind,en,"Traces the relationship between Tina, a young Mexican trans woman, and Eliana, her grandmother, as they navigate Tina's transition and struggle to build a life for themselves as undocumented immigrants in New York City.",/wNGXT2aIiswaY9blHQwowWV8MXq.jpg,[18],6.671,2020-08-28,5.9,5
638757,Tell-By Date,en,"Ryan loves being a dad more than anything, but has never told his son that he’s transgender and not his biological father. As another Father’s Day passes, Ryan imposes a deadline or a ‘Tell-by Date,' but it’s easier set than done!",/7It3eu2uaZqPiFD9TajSdAwbFPc.jpg,"[35, 18]",0.6,2019-05-31,0.0,0
279016,Lady Peacock,en,"Let the drag-off begin! When Conner first meets Devin, he feels an instant attraction to him. However, soon Conner's nemesis, the Puerto Rican drag queen Adora wants Devin all to herself. Conner soon realizes the only way to compete with a drag queen is to become a drag queen. With the help of his club friends, Conner must make it his mission to destroy Adora if he wants to win back Devin.",/vUVUFAYRVbNV2ogPxRfpiPcGiKx.jpg,"[10749, 35]",1.498,2014-01-01,6.0,7
210894,An Affirmative Act,en,"""An Affirmative Act"" is pro-gay marriage film, starring Charles Durning, Eric Etebari, Costas Mandylor, Rachael Robbins, and Blanche Baker, about a lesbian couple where one pretends to be a man in order for the two to get married and equal benefits. A slice of life of a young, professional married couple with their darling baby turns a sharp, dark corner when the pair are arrested and charged with several counts of fraud. The reason: Terry and Samantha Succi aren't the man and woman that they purported to be... Terry and Samantha married under false pretenses, ignoring state law that discriminates against homosexual partners and prohibits them from receiving the same rights and benefits as their straight counterparts.",/x9oa4QRrUwz3PRzYRf2qC8FXt20.jpg,[],1.999,2010-06-04,2.9,7
320701,The Coffee Shop,en,"The Coffee Shop takes place in a gay owned, rainbow-friendly New York restaurant and coffee house where love is constantly tossed into the blender.",/elV0ZABe7IJpqfmKFbPeRsWuagv.jpg,"[18, 10749]",1.39,2014-01-01,5.2,6
27205,Inception,en,"Cobb, a skilled thief who commits corporate espionage by infiltrating the subconscious of his targets is offered a chance to regain his old life as payment for a task considered to be impossible: ""inception"", the implantation of another person's idea into a target's subconscious.",/oYuLEt3zVCKq57qu2F8dT7NIa6f.jpg,"[28, 878, 12]",90.791,2010-07-15,8.367,35184
7326,Juno,en,"Faced with an unplanned pregnancy, sixteen year old high-schooler, Juno MacGuff, makes an unusual decision regarding her unborn child.",/jNIn2tVhpvFD6P9IojldI3mNYcn.jpg,"[35, 18, 10749]",26.065,2007-12-05,7.05,6861
177354,Stud Life,en,"Stud lesbian JJ works with her gay best friend Seb as wedding photographers. When JJ falls in love with a beautiful diva, JJ and Seb's friendship is tested, and she’s forced to chose between her hot new lover and her best friend.",/4VGxuafg0atOEnlfO6Ca40l27Zn.jpg,"[18, 10749]",3.299,2012-03-22,3.8,11
631276,DES!RE,en,"An experimental film exploring desire for transmasculine, butch, stud, and masculine of centre (MOC) people assigned female at birth.",/weVgZgo729G4bYrZQMwXz0C5PDO.jpg,[],0.6,2017-09-27,7.0,2
179447,Fem,en,"Portraying femininity from ancient mythology and popular cinematic culture, Fem subverts images of empowered women to experimental and lyrical effect, with a butch narration from Peggy Shaw of UK Lesbian Feminist Theatre Company ‘Split Britches’.",,[],0.0,2007-11-16,1.0,1
1121353,A Drive to Top Surgery,en,"In a powerful and evocative continuous take of video, we accompany a young transgender person and their family on the journey to their top surgery.",,[],1.4,2023-05-04,0.0,0
61012,Silent Hill: Revelation 3D,en,"Heather Mason and her father have been on the run, always one step ahead of dangerous forces that she doesn't fully understand, Now on the eve of her 18th birthday, plagued by horrific nightmares and the disappearance of her father, Heather discovers she's not who she thinks she is. The revelation leads her deeper into a demonic world that threatens to trap her forever.",/9ZDOzeSzjurGnQYokbRI0hJnmk6.jpg,"[53, 27, 9648]",25.013,2012-10-10,5.5,1517
61012,Silent Hill: Revelation 3D,en,"Heather Mason and her father have been on the run, always one step ahead of dangerous forces that she doesn't fully understand, Now on the eve of her 18th birthday, plagued by horrific nightmares and the disappearance of her father, Heather discovers she's not who she thinks she is. The revelation leads her deeper into a demonic world that threatens to trap her forever.",/9ZDOzeSzjurGnQYokbRI0hJnmk6.jpg,"[53, 27, 9648]",25.013,2012-10-10,5.5,1517
865797,Biosphere,en,"In the not-too-distant future, the last two men on earth must adapt and evolve to save humanity.",/2yqYQMibudBGrqP70mEcv7pNOQX.jpg,"[35, 18, 878, 14]",4.534,2023-07-07,4.796,27
496863,XY Chelsea,en,"The historic story of whistleblower Chelsea Manning. Shot over two years and featuring exclusive interviews and behind-the-scenes verité with Manning, the film picks up on the momentous day in May when she leaves prison and follows her through her journey of discovery.",/vpa3T9OV5mduslVjtKZ0PCGzlEj.jpg,[99],1.489,2019-05-24,6.3,15
350916,Spidarlings,en,"Poverty stricken lovers Eden and Matilda have enough trouble just getting through the days, but when Eden buys a pet spider the real troubles start.",/85D1BQK3GPyXB3cHFaPCuWBLaqK.jpg,"[53, 27, 10402, 35]",1.025,2016-10-31,5.4,5
522547,Grindsploitation 4: Meltsploitation,en,"Grindsploitation 4 is going to be nastier than ever, more shocking, more gore, more blood. Killer faux grindhouse film trailers a homage to the video nasty era of films.",/zSzjCxc0NVviI3wBYEbrCzGlbTs.jpg,[27],1.205,2018-05-01,6.0,3
326197,Trashtastic,en,A collection of Trailers from Low Budget Underground Horror Movies from across the globe,,"[35, 27, 28]",0.654,2013-10-10,5.5,2
634022,Waking Hour,en,"A young trans woman is pursued by a potential lover at a party. As she balances concerns about her safety and her desire for intimacy, she must figure out what she wants before she can go for it.",/jznXxLXZ8ilNiAXHjOBO5vVrYyN.jpg,[],1.349,2019-03-04,0.0,0
212812,The Out List,en,"Through the voices of Americans from all walks of life, The Out List explores the identities of the lesbian, gay, bisexual, and transgender community in America. In this series of intimate interviews, a diverse group of LGBTQ personalities bring color and depth to their experiences of gender and sexuality. With wit and wisdom, this set of trailblazing individuals weaves universal themes of love, loss, trial, and triumph into the determined struggle for full equality.",/5WWDLqUDqAlDlxsMbAG1yHEUGt0.jpg,[99],2.363,2013-06-26,6.1,22
728212,Between the World and Me,en,"Based on Ta-Nehisi Coates’ #1 New York Times bestseller and originally adapted and staged by the Apollo Theater, this special combines elements of that production - including powerful readings from Coates’ book - with documentary footage from the actors’ home life, archival footage, and animation.",/rHntazEQuvO0wSplvOxf5wNdvFO.jpg,"[99, 18]",6.697,2020-11-21,7.9,7
490780,Dark Money,en,"'Dark money' contributions, made possible by the U.S. Supreme Court's Citizens United ruling, flood modern American elections — but Montana is showing Washington D.C. how to solve the problem of unlimited anonymous money in politics.",/tXXq3iBWIs9X1LWSCGLoDGbYNHO.jpg,[99],2.356,2018-01-22,6.8,17
46391,Prodigal Sons,en,"Filmmaker Kimberly Reed returns home for her high school reunion, ready to reintroduce herself to the small town as a transgender woman and hoping for reconciliation with her long-estranged adopted brother Marc. Things are complicated by the shocking revelation that Marc may be the grandson of Orson Welles and Rita Hayworth, forcing Kim and her family to explore questions of sexual orientation, identity, severe trauma and love.",/tKteCP6uovM3zEtD6HEcFfKu1eX.jpg,[99],1.96,2008-08-29,5.375,16
583143,Lingua Franca,en,"Olivia, an undocumented Filipina immigrant paranoid about deportation works as a caregiver to a Russian-Jewish grandmother in Brighton Beach, Brooklyn, NY. When the man she’s secretly paying for a green card marriage backs out, she becomes involved with a slaughterhouse worker who is unaware that she’s a trans woman.",/20HKDrU2QccbEqzHmPJZRzMPoJM.jpg,[18],2.21,2020-07-01,6.3,15
799632,Shangri-La,en,"It’s California, during the Great Depression. A woman is confiding her most intimate thoughts in a church confessional, while the man on the other side listens silently and intently. But this is no ordinary religious ritual seeking salvation. The woman — a second generation Filipino farmhand — is rapt in roleplay reverie, her sensuous words aimed at her white American lover, during a historic period when such interracial relationships were forbidden by state law. The confession box transforms into a romantic time machine, ecstatic and melancholic, traveling into alternate futures. She manifests as multiple, dazzling women, and they can love freely. This is the 21st commission from Miu Miu Women's Tales​ series.",/2yaVYSfY3Ek5SdozYrQmOpyRTPN.jpg,"[18, 10749]",0.787,2021-02-23,5.5,6
1058678,Kokomo City,en,Four Black transgender sex workers in Atlanta and New York City break down the walls of their profession.,/3LehvN7fYx3p4yaPDh8pktXdIo2.jpg,[99],4.967,2023-07-28,7.4,7
369403,"Happy Birthday, Marsha!",en,"It's a hot summer day in June, 1969. Marsha throws herself a birthday party and dreams of performing at a club in town, but no one shows up. Sylvia, Marsha’s best friend, distraught from an unsuccessful introduction between her lover and her family, gets so stoned she forgets about the party. Marsha, Sylvia, and friends eventually meet at the Stonewall Inn to celebrate Marsha's birth. When the police arrive to raid the bar, Marsha and Sylvia are among the first to fight back.",/swu2EWvICxYtZxLTfXHOyWfTr8N.jpg,"[18, 36]",0.887,2018-03-10,1.0,1
612835,Salacia,en,"Tourmaline is an experimental portraitist whose subject is Black trans women. This impressionistic piece concerns Mary Jones, who worked at a New York brothel in the early nineteenth century and was described as a “man-monster” in a tabloid-style lithograph that was published after her arrest, in 1836, for robbery.",/uJhj9QCjOTqHFJttguNlvLbnDwU.jpg,[36],0.636,2019-07-03,1.0,1
495226,Atlantic is a Sea of Bones,en,"Atlantic is a Sea of Bones is a short film drawing from the Lucille Clifton poem of the same name that follows Egyptt LaBejia, an NYC based performer through the 80s, 90s, and 2000's in NYC. The haunting and otherwordly film set to an original score features small every day acts of refusal, resistance, and existence—such as performance and self expression—that have a tremendous impact on the world. The film reveals how the historical and systemic violence, like the killing and policing of black queer and trans life, continue to haunt our contemporary landscapes and is inextricably linked to the ongoing AIDS epidemic and the black queer/trans spaces shaped so intimately by HIV/AIDS, including the spaces where we come together and make life together: public spaces and nightlife spaces.",/yASRIqUBAmrSfU7QH8ogPOBa6PU.jpg,[],1.4,2017-12-03,0.0,0
163316,Wildness,en,"Rooted in the tropical underground of Los Angeles nightlife, Wildness is a portrait of the Silver Platter, a historic bar that has been home to Latin/LGBT immigrant communities since 1963. With a magical-realist flourish the bar itself becomes a character, narrating what happens when a weekly party (organized by Director Wu Tsang, DJs NGUZUNGUZU, and Total Freedom) called Wildness explodes into creativity and conflict. What does ""safe space"" mean? Who needs it? And how does it differ among us? At the Silver Platter, the search for answers creates coalitions across generations.",/rKWhKAQNZwsdksPhCNrXZhJ0ciV.jpg,"[99, 36]",0.6,2012-02-23,6.8,4
657765,You're Dead to Me,en,"Andrea, a grieving Chicana mother, confronts an uninvited family member before her Día de los Muertos celebration. By night's end, death offers her a choice that she couldn't make in life.",/l41RPlybZBfoFmsZKHBV70V1dWF.jpg,[],1.543,2013-07-14,1.5,2
741415,Duilian,cn,"Inspired by the untold personal story of the 19th-century Chinese poet and revolutionary Qiu Jin, Wu Tsang brings to life, subverts, and re-enacts the lesser-known romance and friendship with calligrapher Wu Zhiying. Set in contemporary Hong Kong, the film shifts between time and space, past and present, fact and fiction through Tsang's continued exploration of language and misinterpretation.",/aYkkE9D0SKy8ptw1K5Xzx6D8T7s.jpg,[10749],0.6,2016-03-12,0.0,0
653610,Disclosure,en,"An investigation of how Hollywood's fabled stories have deeply influenced how Americans feel about transgender people, and how transgender people have been taught to feel about themselves.",/2MB2FPNxdSlykbH7ghBltoBYnTH.jpg,[99],20.009,2020-06-19,7.98,125
603,The Matrix,en,"Set in the 22nd century, The Matrix tells the story of a computer hacker who joins a group of underground insurgents fighting the vast and powerful computers who now rule the earth.",/f89U3ADr1oiB1s9GkdPOEpXUk5H.jpg,"[28, 878]",71.106,1999-03-31,8.212,24415
752,V for Vendetta,en,"In a world in which Great Britain has become a fascist state, a masked vigilante known only as “V” conducts guerrilla warfare against the oppressive British government. When V rescues a young woman from the secret police, he finds in her an ally with whom he can continue his fight to free the people of Britain.",/1avD1JeaRiJX5M4ahPdZPypGoGN.jpg,"[28, 53, 878]",36.661,2006-02-23,7.898,13849
