id,title,original_language,overview,poster_path,genre_ids,popularity,release_date,vote_average,vote_count
364365,Panca Delima,ms,"The story tells us about a young prince called Suria Kencana who was cursed and turned into a cobra by his step mother. As a result, he became snake by day and human by night. The magic spell can only be broken by a necklace, Panca Delima, that is worn by a kind hearted girl called Teratai. Teratai has two other evil and greedy sisters. One of them got herself killed when she was too greedy in plucking the gold leaf from the magic tree. The other was envious when Suria Kencana fell for Teratai. She stole the magic necklace and allied herself with Suria's step mother, hoping to get a big reward from her. Did Teratai and Suria managed to break the curse?",/7hMIIrIAtFjtIChPI0TAV667pFY.jpg,[14],0.897,1957-07-07,6.0,1
250925,Bujang Terlajak,en,"""Bujang Telajak"" tells the story of three best friends, played by Saiful, Nabil dan Johan, who fall in love with the same girl, named Puteri (Fazura) and end up competing with each other. The three of them are actually professional magicians, who met Puteri while filming for a commercial. The three friends decide to follow Puteri to learn more about her, only to discover that she is also a kindergarten teacher and part-time model. In order to get closer to Puteri, Saiful turns to her blind father, Haji Hashim (Mustapha Kamal) hoping to hear her secrets from him. To his surprise, Saiful is told by Hashim that Puteri longs to marry with someone who is handicapped, as she believes that it is the only way that she will obtain true love like her mother. And so begins the disguise of the three friends as disabled individuals in order to win Puteri's heart, including sabotaging each other. Who will triumph in this comedic love story?",,[35],0.6,2012-01-19,6.5,2
272364,Kuliah Cinta,en,"A romantic comedy about teenage life on campus. It tells the story of the friendship that develops between Jojo (Johana) and Faramy, since they were kids all the way through college. Things begin to change when they're assigned to oversee the induction of a group of junior students as Faramy secretly falls for one of the students in the group, Ayu. As Faramy and Ayu's relationship gains strength, Jojo is left feeling left out and neglected. At the same time, she receives an offer to go on an exchange student program to Australia and also gets to know a guy called Johan, making Faramy jealous. Both Faramy and Jojo feel the strain as they try to distance themselves from each other. Will Faramy stop Jojo from going to Australia? And what's the conclusion to the battle of egos between them?",/ocIuv9pn1Q2t92KHRqr71nlSNxz.jpg,"[10749, 35]",0.96,2004-01-29,5.5,2
76471,Raya Tak Jadi!,ms,"A businessman named Leo who will be at a great loss because of the containers containing the dates he wants to sell before the election have not arrive. Therefore, he planned to hold a feast by abducting the Great Seal Keeper, Hj.Ehsan. Leo has directed his two employees, Ali and Abu to carry out the abduction. They both succeeded in kidnapping Hj.Ehsan but problems arose when Ali and Abu accidentally exchanged taxi with Hj.Ehsan inside and with Shuib, a taxi driver.",/dpR7Qw4HkyWVNtZm0Sep8I2VYKO.jpg,"[35, 12, 80]",1.607,2011-09-15,4.5,2
217927,XX Ray,ms,"The discovery of XX Ray – a device that allows one to see through things, becomes a disaster when Anuar deliberately sneaks it out and brings it to a party. In the struggle to save this device from Karim, Amir becomes invisible. Will Anuar and Amir succeed in getting the device back or will Amir remain invisible?",/4LZnlDkLAPlHgPrXNbWx2TcV6Fe.jpg,"[35, 878, 12]",0.696,1992-12-23,6.333,3
217928,XX Ray II,ms,"Johan and Tina are cadet scientists at a science centre. Johan claims that he invented a laser disposal machine which actually is Tinas brainchild. Tina request Amir, an astronomer, to help her prevent Johan from using the machine. Amir and Tina sneaks into the centre to destroy the machine but are obstructed by Johan and Shima. The self-operating machine emits a laser beam onto them and they are transferred into a time warp to the Malacca Sultanate. They witness the conflict between Hang Tuah and Hang Jebat. Amir tries to alter history by preventing Hang Tuah from killing Hang Jebat, but he fails to do so.",/uGITVUMpIwtwJJMTZRGBXCYr8J7.jpg,"[28, 878, 12]",0.6,1995-11-24,8.0,2
1020686,Juang,ms,"This RM6.0 million film is Malaysia`s biggest film production to honour the fight against Covid-19; bringing a real-life story to the big screen with five directors, three production houses, 100 artistes and 200 crew members to ensure that Malaysians and our future generations do not forget the pandemic period.",/qtNlKI2qlPRqOuxx1qSCn24Hhyv.jpg,"[18, 28, 10751]",1.4,2022-09-08,7.5,2
895001,The Whole Truth,th,"When two siblings stumble on a strange hole in the wall of their grandparents' house, horrifying incidents reveal sinister secrets about their family.",/6xo2OFHncAymOQtzHwPFF0nyHPl.jpg,"[18, 27, 9648, 53]",22.886,2021-12-02,6.5,215
26687,The Unseeable,th,"Set in 1934 Siam, the story involves a young pregnant woman named Nualchan who's searching for her missing husband. She comes to stay in the spooky rural mansion of a widow, Runjuan.",/iPSR77iTf62h5qdtoLvYIiNgMPw.jpg,"[27, 9648, 18]",4.194,2006-11-02,6.583,42
2805,Tears of the Black Tiger,th,"A homage and parody of 1950s and 1960s Thai romantic melodramas and action films.  Dum, the son of a peasant falls in love with Rumpoey, the daughter of a wealthy and respected family. The star-crossed lovers are torn apart for years, but their forbidden love survives.  When tragedy strikes, Dum unleashes his rage and becomes the gun-slinging outlaw the ""Black Tiger"" who will stop at nothing to seek his revenge.",/3wAdrv8Yp6vsmGi0EPwqYjIbLU1.jpg,"[10749, 35, 28, 37]",3.723,2000-09-29,6.473,37
11606,Last Life in the Universe,th,An obsessive-compulsive Japanese librarian living in Bangkok spends most of his days contemplating suicide in his apartment. His life changes when he witnesses the death of a young girl and becomes acquainted with her elder sister.,/pN6e9bMNfFNsIJZqb924KKu8lq4.jpg,"[18, 28, 53]",8.075,2003-08-03,7.149,138
88573,Headshot,th,A hitman named Tul is shot in the head during an assignment. When he wakes up from a two month coma Tul discovers that he literally sees everything upside down.,/wuZ6uVkuaKfehCSKMKb5SznEkpc.jpg,"[18, 53, 80]",4.649,2011-11-24,6.2,46
33253,6ixtynin9,th,"A woman, fired from a financial corporation during the Asia crisis, returns home with no money. However, she finds a box with a fortune in front of her door, and decides to keep it. However, the people that left it there soon want it back.",/q9hHVuHQX3yTDDUtuIezDz3YC34.jpg,"[35, 80, 53]",3.227,1999-10-20,6.969,48
9316,Ong-Bak,th,"When the head of a statue sacred to a village is stolen, a young martial artist goes to the big city and finds himself taking on the underworld to retrieve it.",/oagqAwp48dMPoCT94yDJUDOCVPi.jpg,"[28, 53, 80, 12]",32.144,2003-01-21,7.086,1581
8982,The Protector,th,"A young fighter named Kham must go to Australia to retrieve his stolen elephant. With the help of a Thai-born Australian detective, Kham must take on all comers, including a gang led by an evil woman and her two deadly bodyguards.",/uKE9BxgtT5g2pE3ZKC7MnzsAbTZ.jpg,"[28, 80, 18, 53]",27.815,2005-08-11,7.1,798
16353,Ong Bak 2,th,Moments from death a young man is rescued by a renowned warrior. Realizing unsurpassed physical potential in the young boy he trains him into the most dangerous man alive. As he becomes a young man he goes on a lone mission of vengeance against the vicious slave traders who enslaved him as a youth and the treacherous warlord who killed his father.,/sGyB8kVPQsofyQV1T0jE2d6k4q4.jpg,"[12, 28, 53]",29.641,2008-12-04,6.4,602
54117,Three,ko,"An anthology consisting of three horror shorts from different Asian directors: Memories by Kim Jee-woon, The Wheel by Nonzee Nimibutr, and Going Home by Peter Chan.",/jhi6iI4CqQwWI97GKmYdpRg4HGq.jpg,"[27, 9648]",5.102,2002-07-09,6.0,63
68507,Jan Dara,th,"Jan is a boy growing up in 1930s Siam in a wealthy, dysfunctional family where sex has a huge impact on everyone's lives. Jan is viewed by his father as cursed, since his mother died giving birth to him.",/vE9h8C2FiOLXwli7NsTcn2MyWm6.jpg,"[10749, 18]",11.161,2001-09-28,5.988,39
52651,Legend of the Tsunami Warrior,th,"As sea pirates threaten to invade their kingdoms, three queens of Langkasuka must band together to defend their lands and peoples.",/6qTqdxSsiHcHqdB8Ob4Im24f6Rl.jpg,"[28, 12, 14, 36]",6.405,2008-08-12,5.957,35
37285,Wonderful Town,th,Local girl Na runs a small hotel where every day is more of less the same until Ta arrives one day. Ta is an architect from the city who has come to oversee the building of a new development and very slowly the two build a friendship that develops into something more romantic.,/55k2ulsWnnUSOXgmhUofAgzGTtn.jpg,"[18, 10749]",1.122,2007-10-08,6.0,22
500900,Ten Years Thailand,th,A collection of short films by five Thai directors imagining their country ten years into the future.,/oNbsLAjziuS1v6Gdwsnem0i7DQs.jpg,[18],1.322,2018-05-08,6.222,9
170002,Hi-So,th,"Ananda has returned home from abroad. Unsure of his career plans, he accepts an invitation to act in a new movie for a famous director. During the filming in a small seaside town, Zoe, his American girlfriend from University, arrives for a week-long visit. But the change of country takes its toll and she soon becomes frustrated with the situation. Meanwhile, Ananda meets another girl on the beach.",/5DL3pvArE4he8FDQHELOD3fXI9h.jpg,"[18, 10749]",1.437,2010-10-24,4.857,7
40127,Art of the Devil,th,"A pregnant woman is abandoned by her lover. Enraged, she goes to a witch doctor and uses black magic to have her ex and his family killed, only for another woman claiming to be her lover's secret mistress to claim his inheritance and move into his house with her children. Not long after that, inexplicable things happen to that family and, one by one, they begin to die.",/rxLlAzwihpsUQQXAbNVmKg2peBZ.jpg,"[27, 9648]",13.397,2004-05-14,6.347,84
39907,Bang Rajan,th,"Set right before the fall of Thailand's old capital, Ayuttaya, Bang Rajan draws on the legend of a village of fighters who bravely fended off the Burmese armies. With no support from the Royal army, the villagers drives the invading Burmese away many times until their names have become legendary during the time. As each subsequent battles becomes fiercer, the villagers tries to forge a canon to battle the enemy in a final battle where everyone, women and children included, die in combat.",/32xDMRnqTAAynUlwLge2WDY9jZq.jpg,"[28, 36, 10752]",3.794,2000-12-29,6.3,32
48705,Bang Rajan 2,th,"After Bang Rajan village’s warriors bravely battled to massive Burmese army was at the end with a defeat, but  their patriotism inspired to other villagers left getting up to fight with the great invader. On the way of the Burmese troops waltzing to seize the capital, a few brave villagers reunited a tiny guerrilla and called themselves as The Talisman paladins to ambush the enemies. Finally the tiny underdog troop became to the major obstruction when the Burmese army have lost many soldiers in battle.",/csFpGsGSm9YpIrTBLZfy9kUlpDO.jpg,"[28, 18, 36, 10752]",2.744,2010-03-25,5.9,7
1082449,Doi Boy,th,"Sorn, an ethnic Shan sex worker, tries to build a future in Chiang Mai, Thailand, as a refugee far from home, but he is drawn into a complex relationship with one client, an investigator probing a political activist.",/nFjNdswa8V8OyhwmhX31JB6ENkG.jpg,"[18, 53, 10749]",8.998,2023-10-07,6.441,17
456188,#BKKY,th,"Jojo, a 17-year-old girl from Bangkok, is about to graduate from high school. After her friend Q reveals a secret to her, the two girls grow close and spend all their time together. Jojo's father wholeheartedly approves of the friendship and is just glad that Jojo is not going on any dates with boys.",/TQZlcfSAEi5slkQQdJppYQkCNU.jpg,"[18, 99]",0.753,2017-08-03,4.4,4
206358,Boundary,th,"The 2011 New Year celebration at the Ratchaprasong Junction in Bangkok. This is where demonstrators’ protests were violently crushed a few months earlier, with more than 100 people ending up dead. It was there that the conflict between the largely rural ""red shirts"" and the more affluent, royalist ""yellow shirts"" escalated. How did this come to pass? Filmmaker Nontawat Numbenchapol came across young soldier Aod by chance, who had just completed his military service, and asked if he could accompany the soldier on his way home. Aod’s village is on the border to Cambodia and near the Hindu temple of Prasat Preah Vihea, which both countries claim as their own. Here too, a violent conflict is smouldering.",/fUlN5idtMG0nwYKtoJ8OpY2C0Yt.jpg,[99],0.6,2013-02-12,5.0,3
13436,13: Game of Death,th,"After losing his job, his car and his money, Phuchit, races against time to complete 13 tasks ordered by an anonymous caller who promised 100 million Baht upon completion.",/wCAKAY9u5pj5X6rVpgzmTdXbFUc.jpg,"[27, 53, 80]",6.226,2006-10-04,6.4,142
56295,Love of Siam,th,"Two young boys are best friends living quiet family lives in Bangkok. Their lives are disrupted when one boy's older sister goes missing on a jungle trip. The shattered family moves away, separating the boys. Years later, now in their late teens, the boys meet again. One of them is now the leader of an aspiring boy band whose managing assistant bears a striking resemblance to the lost sister. The boys must deal with their family and social lives and their feelings for each other.",/7ntWiqcLBah2QbRu0yfvgTCTc0R.jpg,"[18, 10749]",6.316,2007-11-22,7.316,68
199207,The Line of Destiny,si,"A sprawling portrait of rural life in Sri Lanka; the story revolves around a boy and his friend--a blind girl who he accidentally 'heals' by giving her sight. Though the girl believes the boy healed her, in reality the boy has no such powers. The father of the boy fools the village folk into believing he's a healer, but ultimately the sham is exposed, causing the village to revolt against the boy and his family.",/i0aTBWa5tgFHiIbQSD8PxfXtSmf.jpg,[18],0.84,1956-12-28,6.8,7
218838,Village in the Jungle,si,"Baddegama or, more correctly, Beddegama is a 1980 award winning Sinhalese language film directed by Lester James Peries that follows the lives of village people in British Colonial Sri Lanka. The film is based on the 1913 book titled as ""The Village in the Jungle"" by Leonard Woolf.",/jf1aylIYBbMxDfeyIB932kw8WVb.jpg,[18],1.276,1980-01-01,5.8,5
256408,Changes in the Village,si,"Piyal is a handsome young teacher who is hired to teach English to Nanda, a member of a high class family. They fall in love, but can't elope because Piyal is of a lower class. Nanda's parents instead push her into a marriage with Jinadasa, who is of the same class as them. With economic downturn in Sri Lanka, both families lose their status and Jinadasa leaves to try to make a better life for himself; he never achieves his goal and dies penniless. Piyal and Nanda can now finally come together. They have changed however, and the earlier idylic nature of their relationship is not recaptured.",/4DcE1EJBFvCmlM6ea6iQ2YdqPxo.jpg,[18],1.4,1963-07-21,5.4,5
199207,The Line of Destiny,si,"A sprawling portrait of rural life in Sri Lanka; the story revolves around a boy and his friend--a blind girl who he accidentally 'heals' by giving her sight. Though the girl believes the boy healed her, in reality the boy has no such powers. The father of the boy fools the village folk into believing he's a healer, but ultimately the sham is exposed, causing the village to revolt against the boy and his family.",/i0aTBWa5tgFHiIbQSD8PxfXtSmf.jpg,[18],0.84,1956-12-28,6.8,7
218838,Village in the Jungle,si,"Baddegama or, more correctly, Beddegama is a 1980 award winning Sinhalese language film directed by Lester James Peries that follows the lives of village people in British Colonial Sri Lanka. The film is based on the 1913 book titled as ""The Village in the Jungle"" by Leonard Woolf.",/jf1aylIYBbMxDfeyIB932kw8WVb.jpg,[18],1.276,1980-01-01,5.8,5
256408,Changes in the Village,si,"Piyal is a handsome young teacher who is hired to teach English to Nanda, a member of a high class family. They fall in love, but can't elope because Piyal is of a lower class. Nanda's parents instead push her into a marriage with Jinadasa, who is of the same class as them. With economic downturn in Sri Lanka, both families lose their status and Jinadasa leaves to try to make a better life for himself; he never achieves his goal and dies penniless. Piyal and Nanda can now finally come together. They have changed however, and the earlier idylic nature of their relationship is not recaptured.",/4DcE1EJBFvCmlM6ea6iQ2YdqPxo.jpg,[18],1.4,1963-07-21,5.4,5
83221,The Forsaken Land,si,A home-guard serviceman assigned the task of standing watch over a barren no-man's-land begins to experience an existential crisis after years of lonely service.,/hRPCWykVJfC2qMNRiOPXrOLPZDo.jpg,"[18, 10749]",1.144,2005-05-14,4.4,7
203221,Between Two Worlds,si,"A man washes up on a beach. He saves a foreign woman and together they flee into nature. There they discover that the beauty of the environment only distracts from the growing threat. Behind the serene greenery hides death and destruction. Where did they end up? The present and past of the country merge imperceptibly into one another. This is a battle of all times, with the landscape as a silent witness.",/6LyeRw0KoxLzqpdOrOSIBVxK3yB.jpg,[18],0.6,2009-09-07,5.7,6
464910,60 Seconds of Solitude in Year Zero,en,"An anthology of one-minute films created by 60 international filmmakers on the theme of the death of cinema. Intended as an ode to 35mm, the film was screened one time only on a purpose-built 20x12 meter public cinema screen in the Port of Tallinn, Estonia, on 22 December 2011. A special projector was constructed for the event which allowed the actual filmstrip to be burnt at the same time as the film was shown.",/9HcuU9JzCWTweaAL8KsCtTTWa4U.jpg,"[18, 35, 99, 16, 27, 53, 9648]",2.184,2011-12-22,4.3,3
410732,Pura Handa Kaluwara,si,Drama about a father who refuses to believe in his son's death at war.,/syGDMZyDKcVQjn9vh22EqkzwRbK.jpg,[18],0.762,1997-01-03,6.333,6
410568,Anantha Rathriya,si,"Suwisal has turned 40. He's a forgetful businessman, a philanderer, indifferent to life around him, including his young and lovely fiancée. A visit to the house of his childhood triggers memories that continue to cascade when he is called for jury duty to hear the case against Piyum, a servant he seduced and abandoned 20 years before. Now a prostitute, she is on trial for murder.",/ojCgmry9pVhny43CmzxItuMLcS7.jpg,[18],1.4,1996-01-05,5.7,3
370349,August Sun,si,"Set in Sri Lanka during the mid-1990s, August Sun tells three simultaneous stories against the backdrop of the country's savage civil war (1983 – 2009).",,[18],0.6,2003-09-05,5.7,3
256677,The Girls,si,The Girls is about the growing up of two schoolgirl sisters and the disappointments to which they are condemned by their impoverished backgrounds.,/se6D8tSKCsQIBGxgLXKT0Cdi8fW.jpg,[18],0.6,1978-03-17,6.5,2
433685,Loku Duwa,en,"""Loku Duwa"" depicts an attractive and self-sacrificing daughter of the middle class in the city who is trapped in a family of traditional values.",/A7FeKhTGWM5YGaue5aotTWQR33k.jpg,[],0.676,1994-01-01,0.0,0
518461,The Tree Goddess,si,"Vaishnavee (The Goddess), (Sinhalese: වෛෂ්ණාවී) is a 2018 Sri Lankan Sinhala drama thriller film directed by veteran director Sumitra Peries and produced by Mano Nanayakkara.  1930’s, Sri Lanka. Partly a compelling domestic drama, and a demonic love story, the narrative follows a puppet-maker who’s set to be married to a young girl. Unfortunately, the girl elopes with her secret lover. Devastated, the grieving puppet-maker ends up carving a puppet in her likeness, which eventually comes to life, setting in motion a fantastical chain of events.",/iDESlpCIr7zEYSMZqSvNEb9uksg.jpg,"[18, 10749]",0.659,2018-04-05,0.0,0
322693,Flying with One Wing,si,"In order to avoid the gender discrimination prevelent in Sri Lanka, a woman decides to pass as a man and gets a job as a mechanic and even takes a wife.",/zHk5atL8CPf2QWlZko7zMBDvcpZ.jpg,[18],0.6,2002-09-27,4.4,6
408097,A Letter of Fire,si,"A schoolboy and his friend are caught at school looking at pornography on the computer. Punished, they wrongly believe that the police are going to arrest them so they hide in an abandoned building and as the boys feel cornered, and fearing for their lives, one of them accidentally kills a prostitute with a dagger thinking she was a mugger...",/1LiTOA7jSNUHK3L4qQhEcMMogco.jpg,[18],4.188,2005-09-25,4.2,5
485143,This Is My Moon,si,"Set in a Northern border village during the Sri Lankan Civil War, a Sinhalese soldier meets a Tamil girl in the battlefield. The soldier leaves the army with the girl, and goes back to his village. The arrival of the Tamil girl into this predominantly Sinhala village causes a stir within the community, where they collectively decide to send her to a refugee camp. ""This is My Moon"" is a controversial examination of village life, where rural myths are shattered to reveal a deeper reality of a society torn apart by war.",/gzD5AjJs84VJDM27ydUbLJ4NyBR.jpg,[10752],0.6,2000-12-09,4.0,3
451548,Hansa Vilak,si,"A married man (Nissanka) and woman (Miranda) find their lives disrupted after their affair is exposed by the police. Leaving their respective families, the two decide to live together. Shortly afterwards, Miranda secretly goes back to see her former husband. As paranoia mounts, Nissanka disintegrates psychologically to point where reality and fantasy are blurred.",/JIBBUHn7SWLTBpup9zLEV6uETV.jpg,[18],1.55,1980-04-09,7.0,3
199207,The Line of Destiny,si,"A sprawling portrait of rural life in Sri Lanka; the story revolves around a boy and his friend--a blind girl who he accidentally 'heals' by giving her sight. Though the girl believes the boy healed her, in reality the boy has no such powers. The father of the boy fools the village folk into believing he's a healer, but ultimately the sham is exposed, causing the village to revolt against the boy and his family.",/i0aTBWa5tgFHiIbQSD8PxfXtSmf.jpg,[18],0.84,1956-12-28,6.8,7
809044,Maruwa Samaga Wase - මරුවා සමඟ වාසේ,si,"Based on the character of the infamous bandit Marusira, Maruwa Samaga Wase is another movie that was directed by Titus Thotawatte. Marusira A.K.A Siripala is a criminal who escaped death three times but was finally put to rest, which actually caused a huge controversy in society.",/r1dDxMQozVzhAw7vIYszKAUM8PB.jpg,"[80, 18]",0.664,1977-09-30,0.0,0
249613,The Treasure,si,"Based on a short story written by G.B. Senanayake in one of his short story collection known as ""The Revenge,""  the film revolves around a murder committed for the purpose of gaining access to a hidden treasure.",/2X9DzIy96CX6Aknvo6rSfmzgoAs.jpg,"[9648, 53, 18]",0.73,1973-01-01,6.3,3
704857,Sack of Vijayabahu,si,"In the 16th century Kingdom of Kotte, a young woman falls in love with a spy despite her engagement to a soldier.",/j6Ybqzp5MdihWwOfXwMJMHTco5n.jpg,"[18, 36, 10749]",0.6,2019-08-01,10.0,1
810588,Welikathara,si,"An intense, cat-and-mouse drama between newly appointed ASP Randeniya and a local thug (Goring Mudalali). Randeniya's life gradually falls apart as he wages war against Goring Mudalali's crime syndicate, erupting in a shocking climax.",/wHBuC0e8ySx8w4TlVQEiRNpM9RJ.jpg,"[18, 53]",1.37,1971-10-27,9.0,1
810588,Welikathara,si,"An intense, cat-and-mouse drama between newly appointed ASP Randeniya and a local thug (Goring Mudalali). Randeniya's life gradually falls apart as he wages war against Goring Mudalali's crime syndicate, erupting in a shocking climax.",/wHBuC0e8ySx8w4TlVQEiRNpM9RJ.jpg,"[18, 53]",1.37,1971-10-27,9.0,1
260817,The Seventh Bullet,ru,"Despite the restoration of Soviet power in the area, Basmachis continue to arrive from across the border, bringing death and destruction to peaceful villages. One of the bands of rebels is led by Khairulla who is pitted against the militsiya (local militia) leader Maxumov. At first it seems hopeless for Maxumov as the rebels capture most of his men, winning them over to his side. He has only one strategy left; to give himself up, and try to explain to the people that Khairulla has deceived them, turning the soldiers back to revolution. Later in pursuit of his enemy, he chases Khairulla across a river. He has only one bullet left -- the seventh, and he must not miss his target!",/vqrGlcAuPABSajhnm7jfPJmEqSD.jpg,"[12, 10752]",0.6,1973-04-30,4.786,7
406293,The Garden of Desires,ru,"The film is set during the last summer before the Great Patriotic War. Three sisters are coming to stay with their grandmother in the village. They imagine the world as a vast and charming ""Garden of desires"" and all members of the household are waiting for Asya's birthday. Asya has a sense of foreboding regarding the impending grief. Guests come to visit but none of them are her parents. She still does not know that her father was declared an enemy of the people, that tomorrow she will not see her mother and that the war is approaching.",/d7LQFsrI7r8O9aoUmrMCWnLdTLd.jpg,[],0.6,1987-01-01,5.4,5
284377,Hot Summer in Kabul,ru,"A Russian doctor is invited to work at Afghanistan's top hospital during the war, and sees firsthand the carnage caused by the Islamist mujaheddin as they attempt to overthrow the socialist government.",/dCfHM3ae3Aa3hSTeH59oBgyukf7.jpg,"[18, 28, 10752]",0.802,1983-01-02,5.0,5
