id,title,original_language,overview,poster_path,genre_ids,popularity,release_date,vote_average,vote_count
48336,Lumière and Company,fr,"40 international directors were asked to make a short film using the original Cinematographe invented by the Lumière Brothers, working under conditions similar to those of 1895. There were three rules: (1) The film could be no longer than 52 seconds, (2) no synchronized sound was permitted, and (3) no more than three takes.",/bSQ394UJb2xjMfwucHiHxg8XR5f.jpg,[99],4.441,1995-12-20,6.273,64
40365,The Blood Spattered Bride,es,"A young newlywed woman begins to have disturbing nightmares just after settling into the old mansion that has belonged to her husband's family for centuries. When her sinister dreams come true, the innocent bride is caught in a maddening maze of unspeakable horrors.",/sF4K5yEHyti0j6qabggbgHESo6f.jpg,"[18, 27, 53]",9.248,1972-09-30,5.944,63
26165,Mad Love,es,"The tragic fate of Juana I of Castille, Queen of Spain, madly in love to an unfaithful husband, Felipe el Hermoso, Archduke of Austria.",/aCtPDFPQ1pQzYz3l2ge3y34hcZp.jpg,"[18, 36, 10749]",8.866,2001-09-28,6.1,61
116342,Entre esquelas,en,"Heras Victor is a young man who works as a journalist. Among his occupations is responsible for the obituary section. One day, out of curiosity is one of the burials that have appeared under his name and there he meets a mysterious woman who will become an obsession for him. Try to find out more about it, because the attraction was immediate and totally absorbing.",,[],0.843,2012-06-29,0.0,0
214439,Mirame la palomita,es,"Cayetano (Jorge Porcel), a mediocre talent agent, traveling to Mar del Plata with his wife, Carola (Susana Traverso), to fix the contract Jose (Mario Sapag), representing an unknown wannabe comic number in different places. On the road they see a sign advertising that announces the latest film from actor famous erotic films, Federico Lupa (Alberto Olmedo). The praise of it cause a bitter argument between the two. Once in the city and with the excuse of having a lot of work, meets Cayetano José and together they go to the casino and how much fun with beautiful young woman crosses their path. The accident causes the car to Carola descomponérsele amid torrential rain, it Federico Lupa precisely who stop to help and take her home ...",/sibPXfrtWz4m4yxSiR0RP5xv4ue.jpg,[35],4.17,1985-03-07,6.9,52
366980,Peculiar Attraction,es,"A television director decides to make a show about the invasion of transvestites in Mar del Plata. He commissions one of his editors, Jorge Trolombati, who must infiltrate and impersonate one.",/vcGmCf3c0UD7a8BfKHq8ba7Jafn.jpg,[35],2.423,1988-03-03,7.5,23
548036,Two Crazy Pirates 2,es,,/lWWvEwUcPRh4kcG5rjgAKPhXsJt.jpg,[35],5.072,1986-07-10,7.708,24
214439,Mirame la palomita,es,"Cayetano (Jorge Porcel), a mediocre talent agent, traveling to Mar del Plata with his wife, Carola (Susana Traverso), to fix the contract Jose (Mario Sapag), representing an unknown wannabe comic number in different places. On the road they see a sign advertising that announces the latest film from actor famous erotic films, Federico Lupa (Alberto Olmedo). The praise of it cause a bitter argument between the two. Once in the city and with the excuse of having a lot of work, meets Cayetano José and together they go to the casino and how much fun with beautiful young woman crosses their path. The accident causes the car to Carola descomponérsele amid torrential rain, it Federico Lupa precisely who stop to help and take her home ...",/sibPXfrtWz4m4yxSiR0RP5xv4ue.jpg,[35],4.17,1985-03-07,6.9,52
366980,Peculiar Attraction,es,"A television director decides to make a show about the invasion of transvestites in Mar del Plata. He commissions one of his editors, Jorge Trolombati, who must infiltrate and impersonate one.",/vcGmCf3c0UD7a8BfKHq8ba7Jafn.jpg,[35],2.423,1988-03-03,7.5,23
548036,Two Crazy Pirates 2,es,,/lWWvEwUcPRh4kcG5rjgAKPhXsJt.jpg,[35],5.072,1986-07-10,7.708,24
12086,Machuca,es,"Santiago, capital of Chile during the Marxist government of elected, highly controversial president Salvador Allende. Father McEnroe supports his leftist views by introducing a program at the prestigious ""collegio"" (Catholic prep school) St. Patrick to allow free admission of some proletarian kids. One of them is Pedro Machuca, slum-raised son of the cleaning lady in Gonzalo Infante's liberal-bourgeois home. Yet the new classmates become buddies, paradoxically protesting together as Gonzalo gets adopted by Pedro's slum family and gang. But the adults spoil that too, not in the least when general Pinochet's coup ousts Allende, and supporters such as McEnroe.",/sP3ceWIvq7DZm8VLYWuFKzbDK43.jpg,[18],8.578,2004-02-24,7.738,191
589540,Spider,es,Three friends are part of a fascist opposition group in the chaotic Chile of the early 70's and together commit a political crime that changes the history of the country and incidentally involves them in a betrayal that separates them forever.,/xtytny3dRpIYdHsDMq7fTFRxHM6.jpg,"[18, 80, 53]",3.13,2019-08-15,6.893,42
80717,Violeta Went to Heaven,es,"A portrait of famed Chilean singer and folklorist Violeta Parra filled with her musical work, her memories, her loves and her hopes.",/lE3N29dnqqiIcKKdvAZpVcQZ9b.jpg,"[18, 10402]",0.71,2011-08-11,6.869,42
1933,The Others,en,"Grace is a religious woman who lives in an old house kept dark because her two children, Anne and Nicholas, have a rare sensitivity to light. When the family begins to suspect the house is haunted, Grace fights to protect her children at any cost in the face of strange events and disturbing visions.",/p8g1vlTvpM6nr2hMMiZ1fUlKF0D.jpg,"[27, 9648, 53]",31.915,2001-08-02,7.611,6100
1903,Vanilla Sky,en,"David Aames has it all: wealth, good looks and gorgeous women on his arm. But just as he begins falling for the warmhearted Sofia, his face is horribly disfigured in a car accident. That's just the beginning of his troubles as the lines between illusion and reality, between life and death, are blurred.",/l1MBK6BUkZtjEqceEMubDUtvvK3.jpg,"[14, 53, 10749]",25.098,2001-12-14,6.8,3929
241257,Regression,en,"Minnesota, 1990. Detective Bruce Kenner investigates the case of young Angela, who accuses her father, John Gray, of an unspeakable crime. When John unexpectedly and without recollection admits guilt, renowned psychologist Dr. Raines is brought in to help him relive his memories and what they discover unmasks a horrifying nationwide mystery.",/luHpMTmU1ygtEgdOTSSj0i9nd8E.jpg,"[27, 9648, 53]",17.763,2015-10-01,5.577,1722
1933,The Others,en,"Grace is a religious woman who lives in an old house kept dark because her two children, Anne and Nicholas, have a rare sensitivity to light. When the family begins to suspect the house is haunted, Grace fights to protect her children at any cost in the face of strange events and disturbing visions.",/p8g1vlTvpM6nr2hMMiZ1fUlKF0D.jpg,"[27, 9648, 53]",31.915,2001-08-02,7.611,6100
1903,Vanilla Sky,en,"David Aames has it all: wealth, good looks and gorgeous women on his arm. But just as he begins falling for the warmhearted Sofia, his face is horribly disfigured in a car accident. That's just the beginning of his troubles as the lines between illusion and reality, between life and death, are blurred.",/l1MBK6BUkZtjEqceEMubDUtvvK3.jpg,"[14, 53, 10749]",25.098,2001-12-14,6.8,3929
241257,Regression,en,"Minnesota, 1990. Detective Bruce Kenner investigates the case of young Angela, who accuses her father, John Gray, of an unspeakable crime. When John unexpectedly and without recollection admits guilt, renowned psychologist Dr. Raines is brought in to help him relive his memories and what they discover unmasks a horrifying nationwide mystery.",/luHpMTmU1ygtEgdOTSSj0i9nd8E.jpg,"[27, 9648, 53]",17.763,2015-10-01,5.577,1722
138870,Vertical Love,es,"The architecture student Estela (Silvia Aguila) makes a suicide attempt after her plans for solving Havana's housing shortage are rejected. This brings her into contact with earthy, cynical hospital nurse Ernesto (Jorge Perugorria). Estela invites him home for dinner, and he succeeds in offending everyone present. Unable to find a quiet spot to be alone, they finally find a squatters' tenement, where their sexual frenzy causes a ceiling to collapse. They next try vertical love in a stalled elevator, trapping people in the modern building minus stairs. Fleeing responsibilities, they stage a romantic rendezvous alongside a country river, but once again they are interrupted as Cuban commissars arrive with papers and forms because the couple constructs a hut beneath a bridge. Amid the misadventures, lust turns to love",/dCPrFcjMF6OkTWAsj6Zsoe6VSbP.jpg,"[35, 18]",0.6,1997-12-16,7.4,5
341551,Think of Me,es,"Seven Scribes tell the story of an actor who represents tricks and false miracles. The people believe that it is the new Christ. The actor denies being Jesus, but the masses need to believe. The Scribes manipulate the faith of the mass in this fable of loves, negations and intrigues.",/3UR4FIHZjmfWPigyZGVC9K5Jlsg.jpg,[18],0.84,1996-01-01,5.4,5
363606,La noche de los inocentes,pt,,,"[18, 35]",0.838,2007-05-01,0.0,0
210577,Gone Girl,en,"With his wife's disappearance having become the focus of an intense media circus, a man sees the spotlight turned on him when it's suspected that he may not be innocent.",/lv5xShBIDPe7m4ufdlV0IAc7Avk.jpg,"[9648, 53, 18]",77.462,2014-10-01,7.894,17773
209112,Batman v Superman: Dawn of Justice,en,"Fearing the actions of a god-like Super Hero left unchecked, Gotham City’s own formidable, forceful vigilante takes on Metropolis’s most revered, modern-day savior, while the world wrestles with what sort of hero it really needs. And with Batman and Superman at war with one another, a new threat quickly arises, putting mankind in greater danger than it’s ever known before.",/5UsK3grJvtQrtzEgqNlDljJW96w.jpg,"[28, 12, 14]",63.904,2016-03-23,5.961,17373
141052,Justice League,en,"Fuelled by his restored faith in humanity and inspired by Superman's selfless act, Bruce Wayne and Diana Prince assemble a team of metahumans consisting of Barry Allen, Arthur Curry and Victor Stone to face the catastrophic threat of Steppenwolf and the Parademons who are on the hunt for three Mother Boxes on Earth.",/eifGNCSDuxJeS1loAXil5bIGgvC.jpg,"[28, 12, 878]",73.898,2017-11-15,6.093,12469
55171,Novel Romance,en,"Book editor Max Normane can perfect anyone’s story apart from her own. Highly successful but highly single, she comes up with a novel plan: a publication in exchange for a sperm donation. But will she get her happy ending?",/m9gsxU4FqGmuRaH5oBd8lrqNsFk.jpg,"[35, 10749]",1.589,2006-10-08,4.5,6
432301,Chappaquiddick,en,"Ted Kennedy's life and political career become derailed in the aftermath of a fatal car accident in 1969 that claims the life of a young campaign strategist, Mary Jo Kopechne.",/kkTD7ufZd7AqAnZP5IMnrQXKRpM.jpg,"[36, 18, 53]",17.692,2018-04-06,6.066,244
11860,Sabrina,en,"An ugly duckling having undergone a remarkable change, still harbors feelings for her crush: a carefree playboy, but not before his business-focused brother has something to say about it.",/z1oNjotUI7D06J4LWQFQzdIuPnf.jpg,"[35, 10749]",16.989,1995-12-15,6.157,573
881164,Boston Strangler,en,"Reporters Loretta McLaughlin and Jean Cole bravely pursue the story of the Boston Strangler at great personal risk, putting their own lives on the line in their quest to uncover the truth.",/oZJfw78ZyPmgNJ0YJ8070nKEF4Y.jpg,"[80, 9648, 53, 18, 36]",23.144,2023-03-17,6.7,557
59981,Legends of Oz: Dorothy's Return,en,"Dorothy wakes up in post-tornado Kansas, only to be whisked back to Oz to try to save her old friends the Scarecrow, the Lion, the Tin Man and Glinda from a devious new villain, the Jester. Wiser the owl, Marshal Mallow, China Princess and Tugg the tugboat join Dorothy on her latest magical journey through the colorful landscape of Oz to restore order and happiness to Emerald City.",/mpMX4avGjpQ0LSgDUTebxdTD81T.jpg,"[16, 10751, 14]",10.78,2014-05-08,6.317,355
146499,Lion of Oz,en,"Before Dorothy landed on the Wicked Witch of the East with her little farm house, the witch had to contend with another resident of middle America. The Lion, who was once part of the Omaha Circus, comes to Oz with the Wizard and starts on an adventure to stop the witch from obtaining the Flower of Oz. As new friends and strange characters look to him for his courage, Lion could loose exactly what it is that makes him so brave. Based upon the book by Roger S. Baum (Great-Grandson of Oz L. Frank Baum, the original author of the Oz books). Written by Max Vaughn",/utXFBWyo4i4LaEZKblOG9viZx5N.jpg,"[16, 10751]",2.14,2000-09-26,5.6,9
263472,Knock Knock,en,"When a devoted husband and father is left home alone for the weekend, two stranded young women unexpectedly knock on his door for help. What starts out as a kind gesture results in a dangerous seduction and a deadly game of cat and mouse.",/cUC4rUb1Cs2KMaZ6RD4uYUEEwls.jpg,"[53, 27]",49.889,2015-06-26,5.348,2970
123103,Aftershock,es,Mayhem and death follow when an earthquake traps a group of tourists in a Chilean town.,/jbPqPMbJbhFttJy2joNVsO7a7Po.jpg,"[27, 53]",16.154,2012-09-12,5.142,309
513399,Super Crazy,es,"A 36-year-old meek woman realizes that there’s younger people trying to outpace her doing much less, so she makes a risky change by removing her filter.",/xKT9Mv1SB7pW9TLOcmhcm9BH4Pc.jpg,[35],7.708,2018-07-04,6.8,251
105894,All Inclusive,es,A family visits an idyllic five-star resort in the Mayan Riviera in order to spend some quality time together for the first time in many years. A series of events will affect each member of the family that will change them forever.,/6YVclM9WhB5vKnbnt3yn5kHhZic.jpg,[18],1.872,2008-03-11,4.9,8
37009,Unfaithful Women,es,"Cecilia Ureta, host of Chile's highest-rated news show, announces the results of a United Nations survey, the conclusion of which states that 62% of Chilean women are or have never been unfaithful. Ironically, Cecilia maintains an extramarital relationship with the network's owner. Maliciously, a rival colleague discovers this during a live broadcast, with tragic results. The revelation spreads becoming a conversation of national interest.",/5U0UWjPgoFnOeckfrVQWWkrXGa3.jpg,"[18, 35]",2.222,2004-11-18,4.6,5
696939,Lizards' Tales,es,"Three stories rooted in violence, mental erosion and hopes that ran through Chile's soul.",,[18],0.876,1989-07-09,0.0,0
13383,Santa Claus,es,"Pitch, the mean-spirited devil, is trying to ruin Christmas. Santa Claus teams up with Merlin the Magician and the children of the world in order to save the day!",/mm3i2KVJUKYsQQsbQ7M9XxOAgMF.jpg,"[10751, 14, 27, 35]",8.785,1959-11-26,6.31,142
42610,Night of the Bloody Apes,es,A surgeon transplants the heart of an ape into his ailing son with horrific results.,/ssE6dACUHnCDGDjATXWX8eiQNLO.jpg,"[27, 878]",5.574,1969-02-05,5.491,53
31243,The Robot vs. The Aztec Mummy,es,A mad doctor builds a robot in order to steal a valuable Aztec treasure from a tomb guarded by a centuries old living mummy.,/z5NR8SLZQ9bcSXig9z72YLAqtzt.jpg,"[878, 27]",2.515,1958-07-17,2.8,50
238268,Little White Dove,es,"A young working class girl falls in love with an upper class boy who is part of the plot to assassinate General Schneider, head of the Chilean Army.",/dWwwtXoKFRq9Bky6fnbo2MIfNRH.jpg,"[18, 10749, 35]",1.4,1973-01-01,6.7,17
87386,The Suns of Easter Island,fr,Six people find a mysterious mark in the center of their left hand and all independently go to Easter Island in hopes to uncover the mystery.,/rDo1ESiEa9gH8N31MeMX1Im2WXt.jpg,"[18, 14, 878]",1.549,1972-08-23,6.2,12
392459,Enough Praying,es,"Many socially-concerned priests in Catholic Latin America have at some time left their parish churches to go and work in the fields and factories of the poor. Such priests, usually adherents of ""liberation theology,"" are called ""worker-priests."" This Chilean film tells the story of how one man became a ""worker-priest"" and won the trust of the poor.",/xXLQ2KpWx1IQ1GuYasoeQeCNrK3.jpg,[18],0.646,1972-08-28,7.2,9
197100,The Brickmakers,es,"This film documents the life of a family of brick makers in the outskirts of Bogotá, using the personal experience of the Castañeda family to expose the exploitation of manual laborers. Marta Rodríguez and Jorge Silva worked on this documentary from 1966 to 1972, establishing a relationship with the family which allows the viewer an intimate look at their hardships.",/wtLRosaGqfCXf8fqdofuDsdpN09.jpg,[99],0.6,1972-12-31,6.3,9
272685,"Our Voice of Earth, Memory and Future",es,"The struggles of the community of the Coconuco indigenous reservation in Cauca, which by the eighteenth-century royal card is entitled to 10,000 hectares, and in 1971 it barely has 1,500.",/iXh4pOzM9E8YgIfsppA2quPiyrr.jpg,[99],1.516,1982-02-01,6.4,6
713067,Campesinos,es,A Colombian documentary that expose the context of the indigenous-farmer movement in the early '70s.,/sWOaSbhC0tkjJi1eV7XckB1E1Qa.jpg,[99],0.65,1975-01-01,6.0,2
639985,Bodas de cristal,es,,/w9VhcZXnUopzCRVoNjIXIeriNaA.jpg,[18],1.76,1975-06-03,0.0,0
770119,José María y María José (Una pareja de hoy),es,,/8ET9o6CwiEyXcDPJxCJ7aaDKLu5.jpg,[18],0.6,1973-08-09,0.0,0
651170,My Tender Matador,es,"Among gunshots and boleros, a passionate relationship flourishes between a lonely transvestite and a young guerrilla during the Pinochet dictatorship.",/7mM9PVIqMJh37pocDuuJH5Q56mt.jpg,"[18, 10749]",3.661,2020-10-15,7.324,54
1025805,Burning Patience,es,Mario is a young fisherman who dreams of becoming a poet. He gets a job as the postman to Pablo Neruda when the legendary writer moves there after being exiled from Chile.,/aCL4YZBsyobwDQZeLdJ0iGOrXvs.jpg,"[10749, 18]",4.13,2022-12-07,6.5,12
307699,Aurora,es,"After reading in the newspaper that a newborn baby was found in a dumpster, a teacher becomes obsessed with giving it a proper burial.",/dIwRVgUmDW4Y7ARnGsX7r7JzdmP.jpg,[18],1.262,2014-10-05,4.7,8
648990,La Casa,es,"Responding to an urgent call for help, a police officer becomes trapped by the evil spirits of a cursed house.",/fvTGWaQejnHQBZbEOrdbb38NBTC.jpg,"[27, 9648]",11.553,2020-01-30,6.301,88
101604,Eternal Blood,es,"Carmila is introduced by 'M' to a sinister role-playing game called ""Eternal Blood"". Once settled in an abandoned house, the group meets Dahmer, a young man who practices vampirism rites and who begins to influence young people, or perhaps... turn them into vampires.",/oX5pBME2LlpU6zlHnU9qcj0FFkb.jpg,"[27, 14, 53]",1.757,2002-10-31,4.9,17
110372,Descendents,es,"In an undefined future, the earth has been destroyed by man, and the air polluted with a mysterious virus that turns humans into zombies. Only a few children are immune to the disease and have adapted to these extreme conditions and survived. Camille, a nine year old girl wanders through these desolate wastelands, protecting herself from zombies and the armed military forces that roam the land killing anyone who might be infected. However, the little girl will find other kids like her that share a recurring dream of: they all have visions of the ocean as their destiny. Together they will try to survive the journey to the ocean in search of an escape from the military who seem to be as determined on their destruction as on the zombies. Written by David Pollison/Solos Website",/9MFFdFlu7zFLjvH4evZqYqoPi7Q.jpg,"[27, 53, 878]",2.843,2008-04-07,4.8,16
1093962,Una vida verdadera: El sacrificio de Miguel Woodward,es,,,[],0.6,2007-01-01,0.0,0
10809,The Newcomers,es,"The story of two brothers who get involved with a sexy stripper and her boss, the nightclub king of Santiago, as told from three perspectives.",/no8dqgIN5O0vhnPz0gEdUVhnypF.jpg,"[18, 53]",3.218,2003-06-12,4.045,11
385340,A Horse Named Elephant,es,Two brothers sneak into a circus in order to free their grandfather's horse and fulfill his last wish.,/9jqJWiklk2pRLY40LYuiSLKPYqP.jpg,"[10751, 14, 12]",1.695,2016-08-04,4.2,4
59492,199 recetas para ser feliz,es,A young married couple going through crisis travel to Spain in search of new opportunities. Their lives are shaken with the unexpected visit of a disturbing girl.,/9lGLk2pqu3o4WF5e5gMJwEJjqg7.jpg,[18],0.6,2008-09-25,2.7,3
65302,Your Name is Justine,pl,"While living with her grandmother in Poland, a young woman falls in love. Her boyfriend is charming and suggests they travel around Europe and work here and there to pay for their trip. Unfortunately, the boyfriend isn't as he seems and the young woman is sold as a prostitute when they cross over to Germany. We follow her ordeal as she tries to free herself and stay sane as time goes by and her captors try to break and condition her to a new life of servitude.",/pBt0Lah4y3g3uO7AkQzCfbghebj.jpg,[53],1.451,2005-08-30,6.5,13
96406,Love in Concrete,es,"Franco de Peña's movie deals with three very different love stories, all taking place on the Avenida Libertador, the main avenue of Caracas.",/95QWtNQrIwZLx4SkGMNeJStt7bd.jpg,"[18, 10749]",1.4,2004-04-20,5.0,3
72855,Jackal of Nahueltoro,es,"Based on an actual murder case that ignited a furious debate over the death penalty in Chile in 1960, this experimental social drama portrays the life and death of an illiterate peasant who, while drunk, murdered the woman with whom he had a relationship and her five children.",/tjcWfo5AJgU7TIyG5TFTpVhgS0t.jpg,"[18, 53]",2.871,1970-05-04,6.722,27
467254,The Wandering Soap Opera,es,"The film revolves around the concept of soap opera. Its structure is based on the assumption that Chilean reality does not exist, but rather is an ensemble of soap operas.",/hsVZr1hdkfnxIxJNjeOQGC97VF3.jpg,"[14, 35, 18]",3.295,2017-08-10,6.6,12
114092,The Frontier,es,"A Chilean teacher, Ramiro, is sentenced to internal exile in a southern town where tidal waves often appear. He falls for a woman, Maite, whose father asks him to take her away. Although he gets his freedom he doesn't leave and when the water rises, Maite and her father die, and Ramiro flees to the hills.",/yXUOAETojuxw4PxK2p9hxqO3qcS.jpg,"[18, 10749]",1.283,1991-10-25,6.1,10
159004,Dirty Wars,en,"Investigative journalist, Jeremy Scahill is pulled into an unexpected journey as he chases down the hidden truth behind America's expanding covert wars, and examines how the US government has responded to international terrorist threats in ways that seem to go against the established laws of the land.",/qR96ukVb0bsBUJpvFuxksZLVBqY.jpg,"[99, 18, 80]",4.75,2013-01-18,7.031,128
20764,Sleep Dealer,en,"Set in a near-future, militarized world marked by closed borders, virtual labor and a global digital network that joins minds and experiences, three strangers risk their lives to connect with each other and break the barriers of technology.",/kFXQ4oMJkXAWjyo7Tr5GrLjmk61.jpg,"[18, 878, 53]",8.491,2008-12-10,5.9,110
140443,The Girl,en,A young Texan mother who loses her child to foster care begins smuggling Mexicans across the border.,/fTHfgbqUjwz3g4Iy8vQSBFEMvQa.jpg,"[18, 53, 10749]",1.376,2012-01-15,6.1,23
290764,Tracers,en,"Wanted by the mafia, a New York City bike messenger escapes into the world of parkour after meeting a beautiful stranger.",/2XoazCkD4gRlqkJK7q6TOTUx1ta.jpg,[28],22.862,2015-01-15,6.023,1037
726429,Xtreme,es,"Two years after the murder of his son and father, a retired hitman sets in motion a carefully crafted revenge plan against the killer: his own brother.",/cwUhVcDeMYYeu8fq5q1OPOoSbZ7.jpg,"[28, 12, 80]",15.528,2021-06-04,6.377,227
749051,Embryo,es,"Kevin and his girlfriend Evelyn are camping in the woods when she is abducted and impregnated by otherworldly beings. As the entity within her begins to grow, Evelyn discovers that her cravings can only be satisfied by human flesh and blood.",/dxbI3kT9mvlc6Yh14xCKFbd0RvE.jpg,"[27, 878]",5.821,2020-10-24,5.8,80
464757,Nightworld,en,"When former LAPD officer Brett Anderson takes a job as head of security at an old apartment building in Sofia, Bulgaria, he soon begins to experience a series of bizarre and terrifying events. Soon after delving into the building's sinister history and investigate its shadowy owners and past employees, Brett uncovers a malevolent force nestled deep in the bowels of the building that will do anything to be set free into our world.",/a35L3GnAVEXr8fozEbWcYUcvYEm.jpg,"[53, 27]",4.439,2017-05-29,4.4,78
404713,Downhill,es,"Deeply upset by the passing of his best friend, a professional BMX rider accepts to partake in a race in Chile. Everything goes as planned until he stumbles upon a man who is infected by a mysterious virus and becomes the target of local assassins.",/eOACVnxwVKmD21wbFQQAen4DgbP.jpg,"[27, 28]",6.084,2016-07-03,3.7,23
749051,Embryo,es,"Kevin and his girlfriend Evelyn are camping in the woods when she is abducted and impregnated by otherworldly beings. As the entity within her begins to grow, Evelyn discovers that her cravings can only be satisfied by human flesh and blood.",/dxbI3kT9mvlc6Yh14xCKFbd0RvE.jpg,"[27, 878]",5.821,2020-10-24,5.8,80
464757,Nightworld,en,"When former LAPD officer Brett Anderson takes a job as head of security at an old apartment building in Sofia, Bulgaria, he soon begins to experience a series of bizarre and terrifying events. Soon after delving into the building's sinister history and investigate its shadowy owners and past employees, Brett uncovers a malevolent force nestled deep in the bowels of the building that will do anything to be set free into our world.",/a35L3GnAVEXr8fozEbWcYUcvYEm.jpg,"[53, 27]",4.439,2017-05-29,4.4,78
404713,Downhill,es,"Deeply upset by the passing of his best friend, a professional BMX rider accepts to partake in a race in Chile. Everything goes as planned until he stumbles upon a man who is infected by a mysterious virus and becomes the target of local assassins.",/eOACVnxwVKmD21wbFQQAen4DgbP.jpg,"[27, 28]",6.084,2016-07-03,3.7,23
